CD005959	The available evidence shows that intramedullary nailing is associated with an increased risk of shoulder impingement, with a related increase in restriction of shoulder movement and need for removal of metalwork. There was insufficient evidence to determine if there were any other important differences, including in functional outcome, between dynamic compression plating and locked intramedullary nailing for humeral shaft fractures.	PX7SGV	There is insufficient evidence from randomised controlled trials to support or refute the use of intramedullary nails for the treatment of acute humeral shaft fractures.	VNCH8M	There is insufficient evidence to support or refute the use of any of the surgical techniques used in the treatment of humerus fractures. Further research is needed.	A	
CD003804	There is no convincing evidence relating type or intensity of diabetic treatment to the prevention or management of cognitive impairment in Type II diabetes. Future research on treatments for diabetes should include standardized assessments of cognitive function as outcome measures.	VNCH8M	There is insufficient evidence to support or refute the use of ginseng for improving cognitive function in patients with type 2 diabetes mellitus.	JB6Z8F	There is insufficient evidence to support or refute the use of ginseng therapy for improving cognitive function in patients with type 2 diabetes mellitus.	A	~=, but B contains more irrelevant information
CD004878	Current evidence does not support a clinically relevant effect of systemic or inhaled glucocorticoids on admissions or length of hospitalisation. Combined dexamethasone and epinephrine may reduce outpatient admissions, but results are exploratory and safety data limited. Future research should further assess the efficacy, harms and applicability of combined therapy.	JB6Z8F	There is insufficient evidence to support the use of oral corticosteroids in the treatment of acute bronchiolitis.	SPNXTA	Corticosteroids reduce the number of children admitted to hospital with acute bronchiolitis, but do not reduce the length of hospital stay. There is no evidence of an increase in the incidence of post-bronchiolititis wheezing.	A	
CD005137	In some cases of unilateral refractive amblyopia it appears that there is a treatment benefit from refractive correction alone. Where amblyopia persists there is evidence that adding occlusion further improves vision. Despite advances in the understanding of the treatment of amblyopia it is currently still not possible to tailor individual treatment plans for amblyopia. The nature of any dose/response effect from occlusion still needs to be clarified. Partial occlusion appears to have the same treatment effect as glasses alone when started simultaneously for the treatment of unilateral refractive amblyopia. Treatment regimes for bilateral and unilateral refractive amblyopia need to be investigated further.	8FWF5T	pharmacologic interventions for amblyopia are effective in improving visual acuity and improving contrast sensitivity. The is no evidence that patching is more effective than placebo or glasses in treating severe amblyopia. The is no evidence that patching is more effective than placebo or glasses in treating mild amblyopia.	PX7SGV	There is insufficient evidence from randomised controlled trials to support the routine use of patching for amblyopia in children aged three to seven years.	A	
CD002231	Based on one low quality trial, the medicinal herb 'Jianpi Wenshen recipe' may have an antiviral activity in asymptomatic carriers of hepatitis B virus. However, rigorous randomised, double-blind, placebo-controlled trials are needed before herbs should be used for this condition.	JB6Z8F	Phyllanthus amarus is effective in the treatment of chronic hepatitis B virus carriers.	SPNXTA	The efficacy of Phyllanthus amarus for the treatment of asymptomatic hepatitis B virus carriers remains unclear. The plant appears to be of no benefit in preventing the spread of hepatitis B viruses to other populations.	B	
CD007191	Based on limited data, azithromycin or clarithromycin appeared to be a prophylactic agent of choice for MAC infection. Further studies are needed, especially direct comparison of clarithromycin and azithromycin. In additions, studies that will compare different doses and regimens are needed.	VNCH8M	Azithromycin is effective in preventing M. avium complex disease in patients with AIDS.	SPNXTA	Prophylaxis with macrolide therapy for M. avium complex infection in AIDS patients who have a CD4 cell count less than 50 is associated with a decreased risk of developing MAC disease, but an increased risk of death due to adverse events.	A	
CD003412	Overall there has been very little good quality research on treatments for BCC. Most trials have only evaluated BCCs in low risk locations. Surgery and radiotherapy appear to be the most effective treatments with surgery showing the lowest failure rates. Although cosmetic outcomes appear good with PDT, long-term follow-up data are needed. Other treatments might have some use but few have been compared to surgery. An ongoing study comparing imiquimod to surgery should clarify whether imiquimod is a useful option.	JB6Z8F	There is insufficient evidence to support the use of topical or systemic agents for the treatment of basal cell carcinoma.	PX7SGV	There is insufficient evidence from randomised controlled trials to support or refute the use of topical 5% cream for the treatment of basal cell carcinoma.	A	
CD004829	The evidence from this review of 21 randomised controlled trials did not support one particular method or technique over another in providing effective conscious sedation and analgesia for pain relief during and after oocyte recovery. The simultaneous use of more than one method of sedation and pain relief resulted in better pain relief than one modality alone. The various approaches and techniques reviewed appeared to be acceptable and were associated with a high degree of satisfaction in women. As women vary in their experience of pain and in coping strategies, the optimal method may be individualised depending on the preferences of both the women and the clinicians and resource availability.	AQ85CE	Isodesox is an effective sedative for women undergoing surgery. It is associated with fewer adverse effects than midazolam and is associated less nausea and vomiting.	SPNXTA	There is no evidence to support the use of any specific analgesic technique during oocyte retrieval.	B	
CD000143	Implications for practice: nasal CPAP is effective in preventing failure of extubation in preterm infants following a period of endotracheal intubation and IPPV. Implication for research: further definition of the gestational age and weight groups in whom these results apply is warranted. Optimal levels of NCPAP as well as methods of administration remain to be determined.	8FWF5T	There is insufficient evidence to support the use of nasal continuous positive airway pressure for early extubation in preterm infants. The evidence is insufficient to support the use of nasal continuous positive airway pressure for early extubation in preterm infants.	VNCH8M	There is no evidence to support the use of NCPAP for elective extubation of preterm infants.	A	insufficient is better than no evidence
CD003700	The evidence does not suggest a significant reduction in mortality, measures of morbidity, nor an effect on the clinical course of pneumonia with vitamin A adjunctive treatment in children with non-measles pneumonia. However, not all studies measured all outcomes, which limited the number of studies that could be incorporated into the meta-analyses, so that there may have been a lack of statistical power to detect statistically significant differences.	PX7SGV	There is insufficient evidence from randomised controlled trials to support the routine use of vitamin A supplementation in children with pneumonia.	JB6Z8F	There is currently insufficient evidence to support the routine use of vitamin A supplementation in the treatment of pneumonia in children.	B	currently
CD005522	Tramadol or tramadol/paracetamol decreases pain intensity, produces symptom relief and improves function, but these benefits are small. Adverse events, although reversible and not life threatening, often cause participants to stop taking the medication and could limit tramadol or tramadol plus paracetamol usefulness.	VNCH8M	Tramadol is an effective analgesic for moderate to severe OA. Its adverse effects are similar to those of other NSAIDs.	JB6Z8F	There is insufficient evidence to support the use of tramadol as an add-on treatment for OA.	B	
CD009190	We found only one RCT, with a moderate risk of bias, which showed that providing PEP support by phone calls did not result in higher adherence to PEP. However, the RCT was conducted in an upper-middle-income country with high HIV prevalence, on a high-risk population and the applicability of its results on other settings and contexts is unclear. There is a need for robust evidence from various settings on the effectiveness of using phone calls for providing PEP support and for other HIV prevention interventions.	VNCH8M	There is insufficient evidence to support the use of psychosocial interventions for improving adherence to antiretroviral therapy after sexual violence.	8FWF5T	There is insufficient evidence to support the use of tablet-based interventions for the treatment of depressive illness. The is a need for well-designed, adequately powered, and adequately powered randomised controlled trials to evaluate the effectiveness of tablet-based interventions for the treatment of depressive illness.	A	
CD002752	Amongst CHF patients who have previously been admitted to hospital for this condition there is now good evidence that case management type interventions led by a heart failure specialist nurse reduces CHF related readmissions after 12 months follow up, all cause readmissions and all cause mortality.  It is not possible to say what the optimal components of these case management type interventions are, however telephone follow up by the nurse specialist was a common component. Multidisciplinary interventions may be effective in reducing both CHF and all cause readmissions. There is currently limited evidence to support interventions whose major component is follow up in a CHF clinic.	VNCH8M	Nurse-led programmes for patients with heart failure reduce hospitalisation and mortality. The effects of nurse-led programmes on quality of life and cost are unclear.	AQ85CE	There is insufficient evidence to support or refute the effectiveness of home-based interventions for improving outcomes for patients with HF after hospital discharge.	A	
CD008870	Sulfasalazine has modest efficacy compared to placebo and is inferior to corticosteroids for the treatment of mild to moderately active Crohn's disease. Olsalazine and low dose mesalamine (1 to 2 g/day) are not superior to placebo. High dose mesalamine (3 to 4.5 g/day) is not more effective than placebo for inducing response or remission. High dose mesalamine was inferior to budesonide for inducing remission in a single trial. In conclusion, sulfasalazine shows modest efficacy for the treatment of active Crohn's disease. However, the existing data show little benefit for 5-aminosalicylates.	VNCH8M	5-ASA is effective in the treatment of active Crohn's disease. Adverse events are common and not serious.	JB6Z8F	There is insufficient evidence to support the use of 5-ASA for the treatment of active Crohn's disease.	B	
CD004735	There is insufficient evidence to guide clinical practice on the benefits and harms of immediate delivery compared with expectant management for women with PPROM. To date all of the clinical trials have had methodological weaknesses and have been underpowered to detect meaningful measures of infant and maternal morbidity.	8FWF5T	There is insufficient evidence to support the use of corticosteroids in the management of preterm rupture of membranes. The is insufficient evidence to support the use of corticosteroids in the management of preterm rupture of membranes.	JB6Z8F	There is insufficient evidence to support the use of any intervention for women with preterm rupture of the membranes.	B	
CD007986	Overall, there is little evidence that PUFA supplementation provides any benefit for the symptoms of ADHD in children and adolescents. The majority of data showed no benefit of PUFA supplementation, although there were some limited data that did show an improvement with combined omega-3 and omega-6 supplementation. It is important that future research addresses current weaknesses in this area, which include small sample sizes, variability of selection criteria, variability of the type and dosage of supplementation, short follow-up times and other methodological weaknesses.	AQ85CE	There is no evidence to support the use of omega-3 fatty acids in the treatment of ADHD or hyperactivity.	8FWF5T	There is no evidence that omega-3 fatty acids are effective for the treatment of hyperactive children. The is some evidence that omega-3 fatty acids may be beneficial for hyperactive children with a range of symptoms. The is no evidence that omega-3 fatty acids are effective for the treatment of hyperactive children with a range of symptoms.	A	
CD003687	ES was shown to have a clinically beneficial effect on grip strength and fatigue resistance for RA patients with muscle atrophy of the hand. However, these conclusions are limited by the low methodological quality of the trial included. More well-designed studies are therefore needed to provide further evidence of the benefits of ES in the management of RA.	PX7SGV	There is insufficient evidence to support or refute the use of electrotherapy for the treatment of atrophied muscle in rheumatoid arthritic hands.	VNCH8M	There is insufficient evidence to determine whether electrotherapy is effective for the treatment of rheumatoid arthritis.	A	
CD004878	Current evidence does not support a clinically relevant effect of systemic or inhaled glucocorticoids on admissions or length of hospitalisation. Combined dexamethasone and epinephrine may reduce outpatient admissions, but results are exploratory and safety data limited. Future research should further assess the efficacy, harms and applicability of combined therapy.	SPNXTA	Corticosteroids reduce the number of children admitted to hospital with acute bronchiolitis, but do not reduce the length of hospital stay. There is no evidence of an increase in the incidence of post-bronchiolititis wheezing.	AQ85CE	In infants with bronchiolitis, nebulisation with inhaled corticosteroids significantly reduces the risk of hospital admission and the risk for pneumonia and mortality compared with saline nebulization alone. In infants with severe broncholitis, the risk is higher with inhaling corticostomy. In children, the benefit of inhaled steroids is small and the benefit is not clear.	B	
CD006746	There is currently no strong evidence for laser peripheral iridoplasty’s use in treating angle-closure.	VNCH8M	There is insufficient evidence to determine whether peripheral iridotomy is superior to iridoplasty in the treatment of primary angle-closure glaucoma.	AQ85CE	There is no evidence to support the use of laser peripheral iridotomy for the treatment of OAG.	B	
CD008361	We could not find convincing evidence that NBI is significantly better than high definition WLC for the detection of patients with colorectal polyps, or colorectal adenomas. We found evidence that NBI might be better than standard definition WLC and equal to high definition WLC for detection the patients with colorectal polyps, or colorectal adenomas.	8FWF5T	There is insufficient evidence to support the use of adenoid coloscopy for the detection of colonic adenomas. The results of this review suggest that the use of adenoid coloscopy is associated with a significant increase in the detection of colonic adenomas. The results of this review suggest that the use of adenoid coloscopy is associated with a significant increase in the detection of colonic adenomas.	JB6Z8F	There is insufficient evidence to support or refute the use of NBI for colonoscopy.	B	
CD000123	Lipid-lowering therapy is effective in reducing cardiovascular mortality and morbidity in people with PAD. It may also improve local symptoms. Until further evidence on the relative effectiveness of different lipid-lowering agents is available, use of a statin in people with PAD and a blood cholesterol level ≥ 3.5 mmol/litre is most indicated.	SPNXTA	In patients with moderately severe and moderately severe intermittent claudication, glycosaminoglycan therapy reduced pain-free walking distance and improved cardiotocography. However, the clinical significance of these reductions is not known.	JB6Z8F	There is insufficient evidence to support the use of cholesterol-lowering drugs for the treatment of intermittent claudication.	A	
CD007771	The evidence base for the use of vitamin D for chronic pain in adults is poor at present. This is due to low quality and insufficient randomised controlled trials in this area of research.	VNCH8M	There is insufficient evidence to support or refute the use of vitamin D for the prevention of rheumatoid arthritis.	8FWF5T	There is insufficient evidence to support the use of calcium-containing drugs for the treatment of rheumatoid arthritis. The is a need for well-designed, well-powered, randomised controlled trials to evaluate the efficacy and safety of calcium-containing drugs for the treatment of rheumatoid arthritis.	A	
CD004277	There is limited evidence that cyclosporine is more effective than standard treatment alone for severe ulcerative colitis. The relatively quick response makes the short-term use of cyclosporine potentially attractive, but the long-term benefit is unclear, when adverse events such as cyclosporine-induced nephrotoxicity may become more obvious. There is a need for additional research on quality of life, costs and long-term results from cyclosporine therapy in severe ulcerative colitis.	SPNXTA	Intravenous cyclosporine is an effective and safe alternative to glucocorticosteroids in patients with UC who have not responded to intravenous corticosteroid therapy.	AQ85CE	Cyclosporine is an effective treatment for the maintenance of remission in patients with severe ulcerative colitis.	B	
CD006728	The current evidence base is too heterogeneous and sparse to draw conclusions on the overall effectiveness of family therapy in the treatment of depression. At this point, use of psychological interventions for the treatment of depression for which there is already an evidence-base would seem to be preferable to family therapy. Further high quality trials examining the effectiveness and comparative effectiveness of explicitly defined forms of family therapy are required.	8FWF5T	There is insufficient evidence to support the use of family-based interventions for the treatment of depression in children and adolescents. The evidence is insufficient to support the use of family-based interventions for the treatment of depression in children and adolescents.	JB6Z8F	There is insufficient evidence to support or refute the use of family therapy as an adjunctive treatment for people with depression.	A	
CD003212	Implications for practice: NIPPV is a useful method of augmenting the beneficial effects of NCPAP in preterm infants. Its use reduces the incidence of symptoms of extubation failure more effectively than NCPAP. Within the limits of the small numbers of infants randomised to NIPPV there is a reassuring absence of the gastrointestinal side effects that were reported in previous case series. Implications for research: Future trials should enroll a sufficient number of infants to detect differences in important outcomes such as chronic lung disease and gastrointestinal perforation. The impact of synchronisation of NIPPV on the technique's safety and efficacy should be established in future trials.	8FWF5T	There is insufficient evidence to support the use of intermittent nasal ventilation in preterm infants. The is insufficient evidence to support the use of nasal ventilation in preterm infants. The is a need for well-designed, well-conducted, multi-centre randomised controlled trials to determine the optimal nasal ventilation mode in preterm infants.	AQ85CE	There is insufficient evidence to support the use of non-invasive ventilation in very low birth weight infants to reduce the risk of extubation.	A	
CD004277	There is limited evidence that cyclosporine is more effective than standard treatment alone for severe ulcerative colitis. The relatively quick response makes the short-term use of cyclosporine potentially attractive, but the long-term benefit is unclear, when adverse events such as cyclosporine-induced nephrotoxicity may become more obvious. There is a need for additional research on quality of life, costs and long-term results from cyclosporine therapy in severe ulcerative colitis.	JB6Z8F	There is insufficient evidence to support the use of cyclosporine as a single treatment for UC.	VNCH8M	There is insufficient evidence to support the use of cyclosporine as a monotherapy for the treatment of patients with severe ulcerative colitis.	B	same
CD002964	Variation in the measures used, the included populations and interventions, and the risk of bias within the included studies limit the conclusions that can be reached. The findings provide some evidence to suggest that parenting programmes may be effective in improving a number of aspects of parent-child interaction both in the short- and long-term, but further research is now needed.	AQ85CE	The review provides some evidence that parenting interventions can improve the quality of life of adolescent mothers and their infants. However, the evidence is limited and the results are heterogeneous. The review highlights the need for more research to be conducted in this area.	JB6Z8F	There is insufficient evidence to support the use of videotape as a means of improving parenting skills among adolescents.	A	
CD008871	Low-dose rate brachytherapy did not reduce biochemical recurrence-free survival versus radical prostatectomy at 5 years. For short-term severe adverse events, low-dose rate brachytherapy was significantly more favorable for urinary incontinence, but radical prostatectomy was significantly more favorable for urinary irritation. Evidence is based on one RCT with high risk of bias.	SPNXTA	There is insufficient evidence from randomised controlled trials to determine whether or not brachytherapy is superior to RRP in the treatment of low-risk prostate cancer.	AQ85CE	There is no evidence to support the use of brachytherapy for low-risk prostate cancer.	A	
CD003948	There is weak evidence from one small trial that 6% miltefosine solution applied topically to people with superficial fungating breast lesions (smaller than 1cm) who have received either previous radiotherapy, surgery, hormonal therapy or chemotherapy for their breast cancer, may slow disease progression. There is insufficient evidence in this review to give a clear direction for practice with regard to improving quality of life or managing wound symptoms associated with fungating wounds. More research is needed.	VNCH8M	There is insufficient evidence to support the use of miltefosine solution as a palliative treatment for cutaneous metastases from breast cancer.	JB6Z8F	There is insufficient evidence to support the use of miltefosine solution as a palliative treatment for cutaneous metastases from breast cancer.	Neither is more accurate (use sparingly)	A==B
CD009109	There is insufficient evidence to support or refute the effectiveness of conventional fillings over crowns for the restoration of root filled teeth. Until more evidence becomes available clinicians should continue to base decisions on how to restore root filled teeth on their own clinical experience, whilst taking into consideration the individual circumstances and preferences of their patients.	8FWF5T	There is no evidence to support or refute the use of metal ceramic crowns for endodontically treated teeth. The is a need for further research to determine the optimal treatment for dental restorations in the treatment of dental caries.	AQ85CE	There is insufficient evidence to determine whether fibre-reinforced post and core systems are superior to metal-reinsulated post and base systems for preventing or controlling crown build-up. There is insufficient information to determine if fibre-resin is superior to other materials for preventing and controlling crown-related complications. There are no data to support or refute the use of fiber-reimaging systems for the prevention of crown-induced complications.	A	
CD007771	The evidence base for the use of vitamin D for chronic pain in adults is poor at present. This is due to low quality and insufficient randomised controlled trials in this area of research.	SPNXTA	There is insufficient evidence to recommend the use of anti-inflammatory drugs in the treatment of rheumatoid arthritis.	JB6Z8F	There is insufficient evidence to support or refute the use of alpha-OH-D3 in the treatment of RA.	B	
