review_id	target	sys_a	A	sys_b	B	Which of A or B more accurately reflects the content of the target summary? (Choices: A, B, Neither)	Notes
CD004737	Delivery of the placenta with cord traction at caesarean section has more advantages compared to manual removal. These are less endometritis; less blood loss; less decrease in haematocrit levels postoperatively; and shorter duration of hospital stay. Future trials should provide information on interval between the delivery of the infant and of the placenta, change in lochia, blood splashing during placental removal and uterine pain after operation, as well as the effects of delayed cord clamping.	PX7SGV	There is insufficient evidence from randomised controlled trials to support or refute the routine removal of the placenta at cesarean section. Further research is needed.	VNCH8M	There is no evidence that manual placenta extraction is associated with a significant increase in operative blood loss or postoperative endometritis.	Neither is more accurate (use sparingly)	
CD003231	The data from the present meta-analysis indicate that tumour recurrence was significantly reduced with intravesical BCG compared to MMC only in the subgroup of patients at high risk of tumour recurrence. However, there was no difference in terms of disease progression or survival, and the decision to use either agent might be based on adverse events and cost.	SPNXTA	There is insufficient evidence from randomised controlled trials to determine whether intravesical therapy is more or less effective than immunotherapy in the treatment of recurrent bladder cancer. Further well-designed randomised trials are required to answer this question.	VNCH8M	There is insufficient evidence to determine whether immunotherapy is more effective than chemotherapy in the treatment of superficial bladder cancer. Further randomised controlled trials are needed to determine whether immunotherapy is more effective than chemotherapy in the treatment of superficial bladder cancer.	A	correct PI, wrong O
CD004888	Peginterferon plus ribavirin may be considered a treatment for patients with chronic hepatitis C and stable HIV who have not received treatment for hepatitis C as the intervention may clear the blood of HCV RNA. Supporting evidence comes mainly from the analysis of this non-validated surrogate outcome assessed in comparisons against other antiviral treatments. There is no evidence on treatment of patients who have relapsed or did not respond to previous therapy. Careful monitoring of adverse events is warranted.	VNCH8M	Interferon-ribavirin is more effective than interferon-peg-INF in the treatment of chronic hepatitis C in HIV-infected patients. However, the adverse events associated with interferon-ribavirin are higher and the duration of treatment longer.	JB6Z8F	There is insufficient evidence to support the use of pegylated interferon-alfa-2b plus ribavirin for the treatment of HCV infection in HIV-infected patients.	B	
CD003654	Diuretics are preferred first-line over CCBs to optimize reduction of cardiovascular events. The review does not distinguish between CCBs, ACE inhibitors or ARBs, but does provide evidence supporting the use of CCBs over β-blockers. Many of the differences found in the current review are not robust and further trials might change the conclusions. More well-designed RCTs studying the mortality and morbidity of patients taking CCBs as compared with other antihypertensive drug classes are needed for patients with different stages of hypertension, different ages, and with different co-morbidities such as diabetes.	8FWF5T	There is some evidence that calcium channel blockers reduce the risk of cardiovascular events in hypertensive patients with renal disease. The is no evidence that calcium channel blockers reduce the risk of renal disease progression or mortality.	SPNXTA	Corticosteroids and calcium channel blockers reduce all-cause mortality and cardiovascular morbidity in hypertensive patients. However, there is no evidence to support the use of calcium antagonists in patients with mild hypertension.	A	
CD007289	P-Chem may reduce the risk of progression to GTN in women with CMs who are at a high risk of malignant transformation; however, current evidence in favour of P-Chem is limited by the poor methodological quality and small size of the included studies. As P-Chem may increase drug resistance, delay treatment of GTN and expose women unnecessarily to toxic side effects, this practice cannot currently be recommended.	8FWF5T	There is insufficient evidence to recommend the use of prophylactic chemotherapy for patients with persistent trophoblastic disease. The results suggest that prophylactic chemotherapy may be beneficial in patients at high risk of developing secondary malignancy. The is a need for well-designed randomised controlled trials to determine the optimal prophylactic chemotherapy for patients with persistent trophoblastic disease.	VNCH8M	There is insufficient evidence to support or refute the use of chemotherapy for patients with complete hydatidiform mole.	A	
CD002815	Considering the small number of patients examined, the methodological flaws in many of the studies and the possibility of publication bias, there is insufficient evidence to support or refute the efficacy of any given form of physiotherapy over another in Parkinson's disease. Another Cochrane review, Physiotherapy for patients with Parkinson's Disease, found that there was insufficient evidence to support or refute the efficacy of physiotherapy compared to no physiotherapy in Parkinson's disease.  A wide range of physiotherapy approaches were used in these studies and a survey of UK physiotherapists confirmed that they also use an eclectic combination of techniques in the treatment of Parkinson's disease (Plant 1999). Therefore a consensus must be found as to 'best practice' physiotherapy for Parkinson's disease. The efficacy of 'standard' physiotherapy should be proved first before examining variations in physiotherapy methods. Therefore large well designed randomised controlled trials are needed to judge the effect of physiotherapy in Parkinson's disease. After this large RCTs are needed to demonstrate the most effective form of physiotherapy in Parkinson's disease. Outcome measures with particular relevance to patients, carers, physiotherapists and physicians should be chosen and the patients monitored for at least 6 months to determine the duration of any effect. The trials should be reported according to CONSORT guidelines (CONSORT 1996).	SPNXTA	There is insufficient evidence to support or refute the use of RAS in the management of patients with Parkinson's disease.	8FWF5T	There is insufficient evidence to support or refute the use of music-based interventions for people with idiopathic myasthenia gravis. The research should focus on the use of music-based interventions for people with idiopathic myasthenia gravis.	A	
CD003654	Diuretics are preferred first-line over CCBs to optimize reduction of cardiovascular events. The review does not distinguish between CCBs, ACE inhibitors or ARBs, but does provide evidence supporting the use of CCBs over β-blockers. Many of the differences found in the current review are not robust and further trials might change the conclusions. More well-designed RCTs studying the mortality and morbidity of patients taking CCBs as compared with other antihypertensive drug classes are needed for patients with different stages of hypertension, different ages, and with different co-morbidities such as diabetes.	AQ85CE	There is no evidence to support the use of ACEi in the prevention of CKD in people with hypertension.	VNCH8M	ACE inhibitors are effective in reducing cardiovascular events in patients with hypertension. However, the evidence is not strong enough to recommend the use of ACE inhibitors over other first-line treatments for hypertension.	B	
CD007771	The evidence base for the use of vitamin D for chronic pain in adults is poor at present. This is due to low quality and insufficient randomised controlled trials in this area of research.	VNCH8M	There is insufficient evidence to support or refute the use of vitamin D for the prevention of rheumatoid arthritis.	AQ85CE	Alfacalcidol is effective in the treatment of RA. Its adverse effects are mild and probably not life threatening.	A	
CD008493	Preoperative statin therapy reduces the odds of post-operative AF and shortens the stay on the ICU and in the hospital. Statin pretreatment had no influence on perioperative mortality, stroke, myocardial infarction or renal failure. Since analysed studies included mainly patients undergoing myocardial revascularizations the results cannot be extrapolated to patients undergoing other cardiac procedures such as heart valve or aortic surgery.	8FWF5T	There is insufficient evidence to support the use of statins in patients undergoing cardiac surgery. The is insufficient evidence to support the use of statins in patients undergoing cardiac surgery. The is insufficient evidence to support the use of statins in patients undergoing cardiac surgery.	AQ85CE	Statins may reduce the risk of MI and myocardial infarction in patients undergoing elective cardiac surgery. However, the evidence is based on a small number of small trials with high risk of bias. The effect of statins on mortality and on major morbidity is unknown.	B	
CD001874	There is no evidence that the use of perioperative local anaesthetic in patients undergoing tonsillectomy improves post-operative pain control. The trials identified were of small size and several involved the perioperative co-administration of intravenous opiates which may have masked any beneficial effect of the local anaesthetic. Further randomised controlled trials are necessary.	AQ85CE	There is no evidence to support the use of any specific surgical intervention for patients undergoing bilateral tonsillectomy. The use of bupivacaine, tonsillar infiltration with 0.25% bupiva, or isotonic saline infusion may reduce pain and may reduce the need for analgesia.	SPNXTA	There is no evidence to support the use of bupivacaine for the control of postoperative pain control in adults undergoing tonsillectomy.	B	
CD001342	For the secondary prevention of recurrent ischemic stroke after TIA or minor stroke of presumed arterial origin, there is sufficient evidence to conclude that vitamin K antagonists in any dose are not more efficacious than antiplatelet therapy and that medium and high intensity anticoagulation leads to a significant increase in major bleeding complications.	SPNXTA	Oral anticoagulants are more effective than aspirin in the prevention of transient ischaemic stroke or RIND. However, there is no evidence to support the use of these drugs in the treatment of patients with non-valuable ischaemia.	PX7SGV	There is insufficient evidence to support or refute the use of anticoagulants for the prevention of stroke in patients with transient ischaemic stroke.	B	
CD001705	Insufficient evidence exists from randomised trials to confirm the relative effects of open versus closed reduction of intracapsular fractures, or the effects of intra-operative impaction or compression of an intracapsular fracture treated by internal fixation.	8FWF5T	There is insufficient evidence to support or refute the use of closed-plate fixation for the treatment of displaced neck fractures. The evidence is insufficient to support or refute the use of closed-plate fixation for the treatment of displaced neck fractures.	SPNXTA	There is insufficient evidence from randomised controlled trials to determine the optimal timing of internal fixation for displaced intracapsular fractures of the neck of the femur.	A	
CD003940	Five new studies were added to the review, but their results do not alter the final conclusion of the review. Implications for practiceDue to there being only one study in children, it is not possible to make recommendations for treatment or prevention of OC in children. Amongst adults, there were few studies per comparison. Due to insufficient evidence, no conclusion could be made about the effectiveness of clotrimazole, nystatin, amphotericin B, itraconazole or ketoconazole with regard to OC prophylaxis. In comparison to placebo, fluconazole is an effective preventative intervention. However, the potential for resistant Candida organisms to develop, as well as the cost of prophylaxis, might impact the feasibility of implementation. No studies were found comparing fluconazole with other interventions. The direction of findings suggests that ketoconazole, fluconazole, itraconazole and clotrimazole improved the treatment outcomes. Implications for researchIt is encouraging that low-cost alternatives are being tested, but more research needs to be on in this area and on interventions like gentian violet and other less expensive anti-fungal drugs to treat OC. More well-designed treatment trials with larger samples are needed to allow for sufficient power to detect differences in not only clinical, but also mycological, response and relapse rates. There is also a strong need for more research to be done on the treatment and prevention of OC in children as it is reported that OC is the most frequent fungal infection in children and adolescents who are HIV positive. More research on the effectiveness of less expensive interventions also needs to be done in resource-poor settings. Currently few trials report outcomes related to quality of life, nutrition, or survival. Future researchers should consider measuring these when planning trials. Development of resistance remains under-studied and more work must be done in this area. It is recommended that trials be more standardised and conform more closely to CONSORT.	SPNXTA	Itraconazole is an effective prophylaxis in preventing oral candidiasis in HIV-positive patients. Itraconaziole may be more effective in preventing oropharyngeal candidiasis than fluconazole. However, there is no evidence to support the use of any of the other antifungal drugs.	VNCH8M	Fluconazole is an effective treatment for oropharyngeal candidiasis in HIV-infected patients. However, the use of fluconazole in combination with systemic antifungal therapy is associated with increased risk of adverse events.	B	
CD008449	The results indicate evidence for the effectiveness of mirror therapy for improving upper extremity motor function, activities of daily living and pain, at least as an adjunct to normal rehabilitation for patients after stroke. Limitations are due to small sample sizes of most included studies, control interventions that are not used routinely in stroke rehabilitation and some methodological limitations of the studies.	PX7SGV	There is insufficient evidence from randomised controlled trials to support the use of mirror therapy for the rehabilitation of the affected upper limb after stroke.	JB6Z8F	There is insufficient evidence to support the use of mirror therapy for improving hand function in stroke patients.	Neither is more accurate (use sparingly)	A == B
CD008361	We could not find convincing evidence that NBI is significantly better than high definition WLC for the detection of patients with colorectal polyps, or colorectal adenomas. We found evidence that NBI might be better than standard definition WLC and equal to high definition WLC for detection the patients with colorectal polyps, or colorectal adenomas.	8FWF5T	There is insufficient evidence to support the use of adenoid coloscopy for the detection of colonic adenomas. The results of this review suggest that the use of adenoid coloscopy is associated with a significant increase in the detection of colonic adenomas. The results of this review suggest that the use of adenoid coloscopy is associated with a significant increase in the detection of colonic adenomas.	AQ85CE	There is evidence that NBI improves the detection of colorectal adenomatous polyps in colorespiratory endoscopy. The evidence is weak and inconclusive. The results of this review suggest that NII may be associated with a small reduction in the risk of colorem adenoma.	B	
CD001342	For the secondary prevention of recurrent ischemic stroke after TIA or minor stroke of presumed arterial origin, there is sufficient evidence to conclude that vitamin K antagonists in any dose are not more efficacious than antiplatelet therapy and that medium and high intensity anticoagulation leads to a significant increase in major bleeding complications.	PX7SGV	There is insufficient evidence to support or refute the use of anticoagulants for the prevention of stroke in patients with transient ischaemic stroke.	8FWF5T	There is insufficient evidence to support the use of aspirin or warfarin for the prevention of stroke in patients with non-valvular coronary artery disease. The evidence is insufficient to support the use of either drug for the prevention of stroke in patients with non-valvular coronary artery disease.	A	
CD003700	The evidence does not suggest a significant reduction in mortality, measures of morbidity, nor an effect on the clinical course of pneumonia with vitamin A adjunctive treatment in children with non-measles pneumonia. However, not all studies measured all outcomes, which limited the number of studies that could be incorporated into the meta-analyses, so that there may have been a lack of statistical power to detect statistically significant differences.	JB6Z8F	There is currently insufficient evidence to support the routine use of vitamin A supplementation in the treatment of pneumonia in children.	AQ85CE	VAS may be beneficial in children with pneumonia. However, the evidence is limited. The trials included in this review were of short duration and of poor quality. Further randomised controlled trials are needed to determine the optimal dose and duration of treatment for children with acute pneumonia.	A	
CD008493	Preoperative statin therapy reduces the odds of post-operative AF and shortens the stay on the ICU and in the hospital. Statin pretreatment had no influence on perioperative mortality, stroke, myocardial infarction or renal failure. Since analysed studies included mainly patients undergoing myocardial revascularizations the results cannot be extrapolated to patients undergoing other cardiac procedures such as heart valve or aortic surgery.	VNCH8M	There is no evidence to support the use of preoperative statins in the prevention of postoperative AF in patients undergoing elective coronary bypass grafting surgery.	SPNXTA	Prophylactic use of statins to reduce the risk of perioperative atrial fibrillation after cardiac surgery is associated with a reduction in the incidence of cardiovascular events and the length of hospital stay.	B	
CD002964	Variation in the measures used, the included populations and interventions, and the risk of bias within the included studies limit the conclusions that can be reached. The findings provide some evidence to suggest that parenting programmes may be effective in improving a number of aspects of parent-child interaction both in the short- and long-term, but further research is now needed.	JB6Z8F	There is insufficient evidence to support the use of videotape as a means of improving parenting skills among adolescents.	SPNXTA	There is some evidence to suggest that culturally sensitive videotape may be beneficial for improving parent-infant interaction. However, the evidence is too limited to draw any conclusions. Further research is needed to assess the effects of culturally insensitive videotape on infant and social functioning.	B	
CD002964	Variation in the measures used, the included populations and interventions, and the risk of bias within the included studies limit the conclusions that can be reached. The findings provide some evidence to suggest that parenting programmes may be effective in improving a number of aspects of parent-child interaction both in the short- and long-term, but further research is now needed.	VNCH8M	There is insufficient evidence to support or refute the use of videotape as a means of improving parenting skills among young people.	AQ85CE	The review provides some evidence that parenting interventions can improve the quality of life of adolescent mothers and their infants. However, the evidence is limited and the results are heterogeneous. The review highlights the need for more research to be conducted in this area.	B	
CD005582	There is moderate quality evidence that corticosteroids given acutely during zoster infection are ineffective in preventing postherpetic neuralgia. In people with acute herpes zoster the risks of administration of corticosteroids do not appear to be greater than with placebo, based on moderate quality evidence. Corticosteroids have been recommended to relieve the zoster-associated pain in the acute phase of disease. If further research is designed to evaluate the efficacy of corticosteroids for herpes zoster, long-term follow-up should be included to observe their effect on the transition from acute pain to postherpetic neuralgia. Future trials should include measurements of function and quality of life.	AQ85CE	The evidence from the two included trials suggests that a short course of antiviral therapy (≥ 7 days) is more effective than a longer course (≤ 7 days), but the evidence from one trial suggests that the addition of corticosteroids to antiviral treatment is not better than a short treatment course alone. The addition of steroids to antivirals is associated with a significant increase in postherpetic neuralgia and genital ulceration. The use of cortics in the treatment of herpes zoster is not recommended.	8FWF5T	There is insufficient evidence to support the use of corticosteroids in the treatment of postherpetic neuralgia. The evidence is insufficient to support the use of prednisolone in the treatment of postherpetic neuralgia. The use of corticosteroids in the treatment of postherpetic neuralgia is not supported by the available evidence.	B	
CD009275	Data for most comparisons were only available from single studies and they are too small for reliable conclusions about which types of dietary advice are the most suitable for women with GDM. Based on the current available evidence, we did not find any significant benefits of the diets investigated. Further larger trials with sufficient power to assess the effects of different diets for women with GDM on maternal and infant health outcomes are needed. Outcomes such as longer-term health outcomes for women and their babies, women's quality of life and health service cost should be included.	PX7SGV	There is insufficient evidence to support or refute the use of a low glycaemic index diet for women with gestational diabetes.	8FWF5T	There is insufficient evidence to support or refute the use of dietary interventions to improve glucose control in women with gestational diabetes. The evidence is insufficient to support or refute the use of dietary interventions to improve glucose control in women with gestational diabetes. The evidence is insufficient to support or refute the use of dietary interventions to improve glucose control in women with gestational diabetes.	B	
CD003804	There is no convincing evidence relating type or intensity of diabetic treatment to the prevention or management of cognitive impairment in Type II diabetes. Future research on treatments for diabetes should include standardized assessments of cognitive function as outcome measures.	8FWF5T	There is insufficient evidence to support the use of ginseng analogues for the treatment of patients with diabetes. The is a need for well-designed, well-powered, and adequately powered randomised controlled trials to evaluate the efficacy of ginseng analogues for the treatment of patients with diabetes.	PX7SGV	There is insufficient evidence from randomised controlled trials to support or refute the use of ginseng for the management of NIDDM.	A	
CD000143	Implications for practice: nasal CPAP is effective in preventing failure of extubation in preterm infants following a period of endotracheal intubation and IPPV. Implication for research: further definition of the gestational age and weight groups in whom these results apply is warranted. Optimal levels of NCPAP as well as methods of administration remain to be determined.	8FWF5T	There is insufficient evidence to support the use of nasal continuous positive airway pressure for early extubation in preterm infants. The evidence is insufficient to support the use of nasal continuous positive airway pressure for early extubation in preterm infants.	AQ85CE	There is insufficient evidence to support the use of CPAP in preterm infants to facilitate the removal of mechanical ventilation. Further research is needed to determine the optimal CPAP strategy.	B	
CD004998	The small number of studies included in this review do not permit any conclusions to be drawn on the effectiveness of meditation therapy for anxiety disorders. Transcendental meditation is comparable with other kinds of relaxation therapies in reducing anxiety, and Kundalini Yoga did not show significant effectiveness in treating obsessive-compulsive disorders compared with Relaxation/Meditation. Drop out rates appear to be high, and adverse effects of meditation have not been reported. More trials are needed.	PX7SGV	There is insufficient evidence to support or refute the use of meditation for the treatment of obsessive-compulsive disorder.	JB6Z8F	There is insufficient evidence to support the use of meditation for the treatment of obsessive-compulsive disorder.	A	support or refute vs just support (technically more correct)
