CD006866	Oral acyclovir did not reduce the incidence of PHN significantly. There is insufficient evidence from randomised controlled trials to determine whether other antiviral treatments prevent PHN. Additional well-designed, randomised controlled trials of famciclovir or other new antiviral agents, with a greater number of participants are needed. Future trials should pay more attention to the severity of pain and quality of life of participants, and should be conducted among different subgroups of people, such as people who are immunocompromised.	AQ85CE	Acyclovir appears to be effective in preventing or treating herpes zoster ophthalmicus. However, the evidence is limited by the small number of trials and the small sample sizes. The evidence for the efficacy of acyclovir in preventing and treating herpes Zoster ocularus is weak and inconclusive.	PX7SGV	Thereral acyclovir appears to be effective in the treatment of acute herpes zoster. There is insufficient evidence from randomised controlled trials to support its use in clinical practice.		
CD006168	Despite some positive results shown in the included trials, there is insufficient evidence that biofeedback is effective for the management of pain during labour.	VNCH8M	There is insufficient evidence to support or refute the use of EMG biofeedback for women in labour. Further research is needed.	AQ85CE	There is insufficient evidence to support the use of biofeedback for pain management during labour.		
CD007345	Prophylactic antibiotics reduce bacteriaemia and seem to prevent cholangitis and septicaemia in patients undergoing elective ERCP. In the subgroup of patients with uncomplicated ERCP, the effect of antibiotics may be less evident. Further research is required to determine whether antibiotics can be given during or after an ERCP if it becomes apparent that biliary obstruction cannot be relieved during that procedure.	SPNXTA	Antibiotic prophylaxis significantly reduces the risk of pancreatitis after ERCP, but the absolute risk is not significant.	8FWF5T	There is no evidence that antibiotic prophylaxis reduces the incidence of post-operative cholangitis or pancreatitis. The evidence is limited by the small number of studies and the heterogeneity of the included studies. The is no evidence that antibiotic prophylaxis reduces the incidence of post-operative sepsis or acute pancreatitis. The evidence is insufficient to support the routine use of antibiotics for biliary tract obstruction.		
CD001539	The provision of recordings or summaries of key consultations may benefit most adults with cancer. Although more research is needed to improve our understanding of these interventions, most patients find them very useful. Practitioners should consider offering people recordings or written summaries of their consultations	PX7SGV	There is insufficient evidence from randomised controlled trials to support the use of audio-visual interventions in the management of patients with cancer.	SPNXTA	There is limited evidence to support the use of audio-taped consultations to enhance the recall of patients and their clinicians regarding clinical information. There is some evidence that tapes may be more effective than standardised consultations in improving recall of information given in a clinical trial. However, the evidence is not strong enough to recommend the widespread use of tapes in clinical practice.		
CD000024	Since the last version of the review, neither of the two new relevant studies have provided additional information to change the conclusions. In patients with acute ischaemic stroke, immediate anticoagulant therapy is not associated with net short or long-term benefit. Treatment with anticoagulants reduced recurrent stroke, deep vein thrombosis and pulmonary embolism, but increased bleeding risk. The data do not support the routine use of any the currently available anticoagulants in acute ischaemic stroke.	AQ85CE	Antiplatelet therapy with LMWH is effective in reducing the risk of major bleeding and major thrombotic complications in patients with acute ischaemic stroke. However, the evidence is limited by the small number of patients studied and the small sample size of the included trials. Further trials are needed to confirm the effectiveness of LMWH in acute ischemic stroke.	PX7SGV	There is insufficient evidence from randomised controlled trials to support the use of heparin in patients with acute ischaemic stroke.		
CD003212	Implications for practice: NIPPV is a useful method of augmenting the beneficial effects of NCPAP in preterm infants. Its use reduces the incidence of symptoms of extubation failure more effectively than NCPAP. Within the limits of the small numbers of infants randomised to NIPPV there is a reassuring absence of the gastrointestinal side effects that were reported in previous case series. Implications for research: Future trials should enroll a sufficient number of infants to detect differences in important outcomes such as chronic lung disease and gastrointestinal perforation. The impact of synchronisation of NIPPV on the technique's safety and efficacy should be established in future trials.	JB6Z8F	There is insufficient evidence to support or refute the use of SNIPPV for extubation of preterm infants.	AQ85CE	There is insufficient evidence to support the use of non-invasive ventilation in very low birth weight infants to reduce the risk of extubation.		
CD007414	There is no evidence to suggest that the use of platinum agents, doxorubicin or paclitaxel used as maintenance chemotherapy is more effective than observation alone. Further investigations regarding the effect of paclitaxel used as maintenance chemotherapy are required.	8FWF5T	There is no evidence that paclitaxel or platinum-based chemotherapy is superior to other forms of chemotherapy for the treatment of recurrent or metastatic ovarian cancer. The results of this review suggest that paclitaxel is associated with a significant reduction in the risk of progression, but this effect is not statistically significant. The results of this review suggest that paclitaxel is associated with a significant reduction in the risk of progression, but this effect is not statistically significant.	PX7SGV	There is insufficient evidence from randomised controlled trials to support or refute the use of consolidation chemotherapy for women with advanced epithelial ovarian cancer.		
CD006616	Overall, this meta-analysis puts doubt on the safety and utility of intravenous N-acetylcysteine as an adjuvant therapy in SIRS and sepsis. At best, N-acetylcysteine is ineffective in reducing mortality and complications in this patient population. At worst, it can be harmful, especially when administered later than 24 hours after the onset of symptoms, by causing cardiovascular depression. Unless future RCTs provide evidence of treatment effect, clinicians should not routinely use intravenous N-acetylcysteine in SIRS or sepsis and academics should not promote its use.	AQ85CE	There is insufficient evidence to support the use of antibiotics in patients with severe sepsis.	JB6Z8F	There is insufficient evidence to support the use of N-acetylcysteine as an adjunct to other interventions for the prevention of acute respiratory distress syndrome in patients with severe acute respiratory failure.		
CD005042	Further research examining the effectiveness of family therapy versus a no-treatment control condition is needed to determine whether family therapy is an effective intervention for children with ADHD. There were no results available from studies investigating forms of family therapy other than behavioural family therapy.	JB6Z8F	There is insufficient evidence to support the use of combination therapy for ADHD.	8FWF5T	There is insufficient evidence to support the use of psychostimulants in the management of children with attention deficit hyperactivity disorder. The is insufficient evidence to support the use of psychostimulants in the management of attention deficit hyperactivity disorder in children with attention deficit hyperactivity disorder.		
CD007345	Prophylactic antibiotics reduce bacteriaemia and seem to prevent cholangitis and septicaemia in patients undergoing elective ERCP. In the subgroup of patients with uncomplicated ERCP, the effect of antibiotics may be less evident. Further research is required to determine whether antibiotics can be given during or after an ERCP if it becomes apparent that biliary obstruction cannot be relieved during that procedure.	AQ85CE	Antibiotic prophylaxis reduces the risk of ERCP-induced cholangitis and the need for further surgery in patients with ERCCP-induced complications.	JB6Z8F	There is insufficient evidence to support the routine use of antibiotic prophylaxis before ERCP.		
CD002781	Topical fluorides (mouthrinses, gels, or varnishes) used in addition to fluoride toothpaste achieve a modest reduction in caries compared to toothpaste used alone. No conclusions about any adverse effects could be reached, because data were scarcely reported in the trials.	VNCH8M	There is no evidence to support the use of fluoride toothpastes for preventing dental caries.	AQ85CE	The evidence from the included studies was limited. There was no evidence of a significant difference in the rate of caries between fluoride toothpastes and mouthrinse, and no evidence that fluoride toothpaste was more effective than mouthrines. There is a need for further well-designed, adequately powered, adequately reported, randomised controlled trials to determine the effectiveness of fluoride toothpaint versus mouthrinets for preventing caries.		
CD000220	Metronidazole, given as a single dose, is likely to provide parasitological cure for trichomoniasis, but it is not known whether this treatment will have any effect on pregnancy outcomes. The cure rate could probably be higher if more partners used the treatment.	8FWF5T	There is insufficient evidence to support the use of metronidazole for the treatment of vaginal candidiasis in preterm women. The results of this review suggest that metronidazole may be beneficial for the prevention of vaginal candidiasis in preterm women.	SPNXTA	Treatment of asymptomatic trichomoniasis with metronidazole 48 hours or 48 hours apart does not prevent preterm birth in women with trichomiasis. However, it does reduce the risk of caesarean section and the time of birth. [Note: The four citations in the awaiting classification section may alter the conclusions of the review once assessed.]		
CD007979	As only one study was identified for inclusion, the results are inadequate to inform clinical practice in regard to the use of email for clinical communication between healthcare professionals. Future research needs to use high-quality study designs that take advantage of the most recent developments in information technology, with consideration of the complexity of email as an intervention, and costs.	8FWF5T	There is insufficient evidence to support or refute the effectiveness of interventions to prevent fractures in post-menopausal women. The evidence is insufficient to support or refute the effectiveness of interventions to prevent fractures in post-menopausal women with osteoporosis. The evidence is insufficient to support or refute the effectiveness of interventions to prevent fractures in post-menopausal women with osteoporosis.	VNCH8M	There is insufficient evidence to support the use of electronic medical record reminders to increase the uptake of osteoporosis medication after a fracture.		
CD002781	Topical fluorides (mouthrinses, gels, or varnishes) used in addition to fluoride toothpaste achieve a modest reduction in caries compared to toothpaste used alone. No conclusions about any adverse effects could be reached, because data were scarcely reported in the trials.	8FWF5T	There is insufficient evidence to support the use of fluoride mouthrinses for the prevention of dental caries in children. The results of this review suggest that fluoride mouthrinses may be effective in the prevention of dental caries in children. The is a need for well-designed, high-quality, randomised controlled trials to evaluate the efficacy of mouthrinses for the prevention of dental caries in children.	AQ85CE	The evidence from the included studies was limited. There was no evidence of a significant difference in the rate of caries between fluoride toothpastes and mouthrinse, and no evidence that fluoride toothpaste was more effective than mouthrines. There is a need for further well-designed, adequately powered, adequately reported, randomised controlled trials to determine the effectiveness of fluoride toothpaint versus mouthrinets for preventing caries.		
CD005944	The lack of effect on maternal and infant mortality and morbidity, with exception of some improved infant morbidity in one small study, and the improvement in maternal vitamin A status, suggest that maternal postpartum vitamin A supplementation offers limited benefits.	JB6Z8F	There is insufficient evidence to support the routine supplementation of mothers with vitamin A to prevent or reduce infant mortality.	AQ85CE	VAS supplementation to mothers after childbirth reduces the risk of neonatal mortality and morbidity in infants born to mothers who are not receiving adequate vitamin A. The effect of VAS supplementation on the risk for neonatal death and morbidities in infants who are receiving VAS is unclear.		
CD002855	Safe and effective medical abortion methods are available. Combined regimens are more effective than single agents. In the combined regimen, the dose of mifepristone can be lowered to 200 mg without significantly decreasing the method effectiveness. Vaginal misoprostol is more effective than oral administration, and has less side effects than sublingual or buccal. Some results are limited by the small numbers of participants on which they are based. Almost all trials were conducted in settings with good access to emergency services, which may limit the generalizability of these results.	8FWF5T	There is insufficient evidence to support the routine use of misoprostol for early medical abortion. The is insufficient evidence to support the routine use of misoprostol for early medical abortion.	SPNXTA	Vaginal misoprostol is an effective method of medical abortion in early pregnancy. It is less effective than mifepristone or mifecristone, or at the same dose, and is associated with higher rates of incomplete abortion. [Note: The six citations in the awaiting classification section of the review may alter the conclusions of the analysis once assessed.]		
CD000246	This review fails to demonstrate a clear overall benefit from prophylactic antibiotic treatment for preterm labour with intact membranes on neonatal outcomes and raises concerns about increased neonatal mortality for those who received antibiotics. This treatment cannot therefore be currently recommended for routine practice. Further research may be justified (when sensitive markers for subclinical infection become available) in order to determine if there is a subgroup of women who could experience benefit from antibiotic treatment for preterm labour prior to membrane rupture, and to identify which antibiotic or combination of antibiotics is most effective. [Note: The 17 citations in the awaiting classification section of the review may alter the conclusions of the review once assessed.]	VNCH8M	There is insufficient evidence to recommend the use of antibiotics for women with intact membranes. Further research is needed to determine whether there is a benefit in terms of preterm birth, or whether there is a reduction in neonatal morbidity.	PX7SGV	There is insufficient evidence to support or refute the routine use of antibiotics in women with intact membranes for preterm birth. Further research is needed.		
CD004878	Current evidence does not support a clinically relevant effect of systemic or inhaled glucocorticoids on admissions or length of hospitalisation. Combined dexamethasone and epinephrine may reduce outpatient admissions, but results are exploratory and safety data limited. Future research should further assess the efficacy, harms and applicability of combined therapy.	8FWF5T	There is insufficient evidence to support the use of corticosteroids in the treatment of children with bronchiolitis. The use of corticosteroids in children with bronchiolitis is associated with a higher risk of hospital admission. The use of corticosteroids in children with bronchiolitis is associated with a higher risk of hospital admission.	VNCH8M	Corticosteroids are effective in the short-term in reducing hospital admission and duration of oxygen therapy in children with acute bronchiolitis. However, the long-term effects of corticosteroids on mortality and hospital stay are not known.		
CD008449	The results indicate evidence for the effectiveness of mirror therapy for improving upper extremity motor function, activities of daily living and pain, at least as an adjunct to normal rehabilitation for patients after stroke. Limitations are due to small sample sizes of most included studies, control interventions that are not used routinely in stroke rehabilitation and some methodological limitations of the studies.	VNCH8M	There is insufficient evidence to support the use of mirror therapy for improving hand function in stroke patients. Further research is needed.	JB6Z8F	There is insufficient evidence to support the use of mirror therapy for improving hand function in stroke patients.		
CD006229	Laparoscopic and small-incision cholecystectomy seem to be equivalent. No differences could be observed in mortality, complications, and postoperative recovery. Small-incision cholecystectomy has a significantly shorter operative time. Complications in elective cholecystectomy are prevalent.	PX7SGV	There laparoscopic cholecystectomy is associated with a shorter hospital stay and a lower rate of postoperative complications. However, there is not enough evidence to support or refute the use of this procedure.	JB6Z8F	There is insufficient evidence to support the use of laparoscopic cholecystectomy for gallstone disease.		
CD007872	Tranexamic acid decreases postpartum blood loss after vaginal birth and after caesarean section based on two RCTs of unclear quality which reported on only a few outcomes. Further investigations are needed to confirm efficacy and safety of this regimen for preventing PPH. These results also provide a basis for the investigation of tranexamic acid for the treatment of PPH.	8FWF5T	There is no evidence that tranexamic acid is effective in reducing blood loss in postpartum women. The results of the included studies are based on small numbers of women and therefore the results should be interpreted with caution.	AQ85CE	Treatment with tranexamic acid immediately before caesarean section reduces the risk of postpartum haemorrhage and the need for transfusion.		
CD003659	There is some evidence that face washing combined with topical tetracycline can be effective in reducing severe trachoma and in increasing the prevalence of clean faces. Current evidence does not however support a beneficial effect of face washing alone or in combination with topical tetracycline in reducing active trachoma.	VNCH8M	There is insufficient evidence to support or refute the use of face -washing as a treatment for trachoma.	SPNXTA	There is insufficient evidence from randomised controlled trials to determine the effectiveness of face-washing as an intervention for improving trachoma prevention in children.		
CD009192	We found only one eligible study. Although this study showed the use of the telephone for HIV test results notification was more effective than face-to-face delivery, it had a high-risk of bias. The study was conducted about 13 years ago in a high-income country, on a high-risk population, with low HIV prevalence, and the applicability of its results to other settings and contexts is unclear. The study did not provide information about telephone HIV test results notification of HIV positive people since none of the intervention group participants were HIV positive. We found no information about the acceptability of the intervention to patients’ and providers’, its economic outcomes or potential adverse effects. There is a need for robust evidence from various settings on the effectiveness of telephone use for HIV test results notification.	JB6Z8F	There is insufficient evidence to support or refute the use of telephone notification for HIV testing in youth.	PX7SGV	There is insufficient evidence from randomised controlled trials to support or refute the use of telephone notification for HIV testing of HIV positive youth.		
CD005137	In some cases of unilateral refractive amblyopia it appears that there is a treatment benefit from refractive correction alone. Where amblyopia persists there is evidence that adding occlusion further improves vision. Despite advances in the understanding of the treatment of amblyopia it is currently still not possible to tailor individual treatment plans for amblyopia. The nature of any dose/response effect from occlusion still needs to be clarified. Partial occlusion appears to have the same treatment effect as glasses alone when started simultaneously for the treatment of unilateral refractive amblyopia. Treatment regimes for bilateral and unilateral refractive amblyopia need to be investigated further.	AQ85CE	The limited evidence available suggests that 2 hours of daily photocoagulation is more effective than 6 hours of continuous photocoage in the treatment of mild amblyopia in children younger than 7 years of age. However, the evidence is based on a small number of small trials with short follow-up periods and is not strong enough to support the routine use of daily patching in this population.	JB6Z8F	There is insufficient evidence to support the use of either full or partial patching for the treatment of amblyopia. Further trials are needed to determine the optimal treatment for amblyopia.		
CD003421	These results suggest that calcium channel blockers given in the peri-operative period may reduce the incidence of ATN post-transplantation. The result should be treated with caution due to the heterogeneity of the trials which made comparison of studies and pooling of data difficult.	SPNXTA	There is some evidence that immunosuppression may improve the outcome of kidney transplantation recipients. However, the evidence is not strong enough to support or refute the use of immunossuppression in this setting. Calcium channel blockers and verapamil may have a beneficial effect on renal function but the evidence for their beneficial effects is inconclusive. Further research is needed to determine the optimal dose and duration of calcium channel blocker administration and to compare these with other immunocompressive agents, including calcium channel blockers.	AQ85CE	There is insufficient evidence to support the use of CCB in the treatment of CKD.		
CD007887	Caffeine has shown effectiveness for treating PDPH, decreasing the proportion of participants with PDPH persistence and those requiring supplementary interventions, when compared with placebo. Gabapentin, theophylline and hydrocortisone have also shown a decrease in pain severity scores when compared with placebo or conventional care. There is a lack of conclusive evidence for the other drugs assessed (sumatriptan and ACTH). These conclusions should be interpreted with caution, due to the lack of information to allow correct appraisal of risk of bias, the small sample sizes of studies and also the limited generalisability, as most participants were post-partum women in their 30s.	JB6Z8F	There is currently no evidence to support the use of intravenous hydrocortisone for the treatment of post-dural puncture headache.	PX7SGV	There is insufficient evidence from randomised controlled trials to support the use of intravenous corticosteroids for the treatment of post-puncture headache.		
CD006133	Current evidence suggests no major differences in carbohydrate metabolism between different hormonal contraceptives in women without diabetes. We cannot make strong statements due to having few studies that compared the same types of contraceptives. Many trials had small numbers of participants and some had large losses. Many of the earlier studies had limited reporting of methods. We still know very little about women at risk for metabolic problems due to being overweight. More than half of the trials had weight restrictions as inclusion criteria. Only one small trial stratified the groups by body mass index (obese versus normal).	VNCH8M	Lactation may be reduced by reducing the dose of progestogens in the combined oral contraceptive. However, the effect on lipid metabolism is not clear. The effect on blood pressure is not clear. There is no evidence of a difference in lipid metabolism between LNG and DS G. There is no evidence of a difference in blood pressure between LNG and DS G.	PX7SGV	There is insufficient evidence from randomised controlled trials to determine the effects of oral contraceptives on glycosylated hemoglobin A1C and triglyceride levels.		
CD003341	Quinine loading dose reduced fever clearance time and parasite clearance time. Data are insufficient to directly demonstrate an impact of loading dose on risk of death.	SPNXTA	There is no evidence to support or refute the use of intravenous quinine for treatment of severe malaria.	PX7SGV	There is insufficient evidence to support or refute the use of intravenous quinine for the treatment of malaria in children.		
