CD004611	There is insufficient evidence to recommend probiotic therapy as an adjunct to antibiotic therapy for C. difficile colitis. There is no evidence to support the use of probiotics alone in the treatment of C. difficile colitis.	8FWF5T	There is insufficient evidence to support the use of probiotics in the treatment of patients with recurrent or complicated clostridium difficile infection. The is a need for larger randomised controlled trials to evaluate the efficacy of probiotics in the treatment of patients with recurrent or complicated clostridium difficile infection.	VNCH8M	There is insufficient evidence to support the use of probiotics for recurrent Clostridium difficile disease.		
CD010257	Antibiotics for COPD exacerbations showed large and consistent beneficial effects across outcomes of patients admitted to an ICU. However, for outpatients and inpatients the results were inconsistent. The risk for treatment failure was significantly reduced in both inpatients and outpatients when all trials (1957 to 2012) were included but not when the analysis for outpatients was restricted to currently used antibiotics. Also, antibiotics had no statistically significant effect on mortality and length of hospital stay in inpatients and almost no data on patient-reported outcomes exist. These inconsistent effects call for research into clinical signs and biomarkers that help identify patients who benefit from antibiotics and patients who experience no effect, and in whom downsides of antibiotics (side effects, costs and multi-resistance) could be avoided.	PX7SGV	Theibiotic therapy appears to be effective in the treatment of acute exacerbations of COPD. However, there is insufficient evidence to support the use of antibiotics in this population. Further research is needed.	SPNXTA	Antibiotic treatment is effective in reducing the number of exacerbations and the time to resolution of symptoms in patients with mild to moderate COPD. However, the magnitude of the treatment effect is small and the clinical significance is unclear. Antibiotic therapy should not be used in the routine management of patients with COPD who have an exacerbation requiring mechanical ventilation.		
CD008288	Although there were significant glucose-lowering effects with the use of some herbal mixtures, due to methodological deficiencies and small sample sizes we are unable to draw any definite conclusions regarding their efficacy. Though no significant adverse events were reported, there is insufficient evidence at present to recommend the use of these interventions in routine clinical practice and further studies are needed.	SPNXTA	There is currently insufficient evidence from RCTs to support or refute the use of herbal medicines for type 2 diabetes mellitus.	PX7SGV	There is insufficient evidence to support or refute the use of herbal medicines for the treatment of type 2 diabetes mellitus.		
CD005542	There is little evidence to support the use of one particular form of insulin administration over another for pregnant women with diabetes. The data are few, there are only a small number of trials appropriate for meta-analysis, a small number of women included and questionable generalisability of the trial population. Conclusions cannot be made from the available data. Well-designed randomised trials are needed. These trials should be adequately powered to assess the effect of CSII versus MDI on important outcomes for women with diabetes and their infants.	SPNXTA	There is insufficient evidence from randomised controlled trials to determine whether enhanced insulin therapy is superior or inferior to other forms of insulin therapy for pregnant women with type 1 diabetes. Further trials are needed to evaluate the comparative effectiveness of enhanced insulin and micropump therapy for type 2 diabetes mellitus.	PX7SGV	There is insufficient evidence from randomised controlled trials to support or refute the use of CSII for women with type 1 diabetes mellitus.		
CD004611	There is insufficient evidence to recommend probiotic therapy as an adjunct to antibiotic therapy for C. difficile colitis. There is no evidence to support the use of probiotics alone in the treatment of C. difficile colitis.	AQ85CE	There is insufficient evidence to support or refute the use of probiotics for the treatment of Clostridium difficile-associated diarrhoea. Further research is needed to determine whether probiotics are beneficial in preventing recurrence of Cl. difficilae.	SPNXTA	There is insufficient evidence to support the use of probiotics in patients with recurrent Clostridium difficile disease.		
CD002892	Limited evidence is available for the effectiveness of interventions to reduce stress levels in healthcare workers. Larger and better quality trials are needed.	8FWF5T	There is insufficient evidence to support or refute the effectiveness of interventions to reduce stress levels in nurses. The is a need for well-designed and adequately powered studies to evaluate the effectiveness of interventions to reduce stress levels in nurses.	AQ85CE	There is insufficient evidence to support the effectiveness of primary care for psychiatric patients.		
CD000246	This review fails to demonstrate a clear overall benefit from prophylactic antibiotic treatment for preterm labour with intact membranes on neonatal outcomes and raises concerns about increased neonatal mortality for those who received antibiotics. This treatment cannot therefore be currently recommended for routine practice. Further research may be justified (when sensitive markers for subclinical infection become available) in order to determine if there is a subgroup of women who could experience benefit from antibiotic treatment for preterm labour prior to membrane rupture, and to identify which antibiotic or combination of antibiotics is most effective. [Note: The 17 citations in the awaiting classification section of the review may alter the conclusions of the review once assessed.]	VNCH8M	There is insufficient evidence to recommend the use of antibiotics for women with intact membranes. Further research is needed to determine whether there is a benefit in terms of preterm birth, or whether there is a reduction in neonatal morbidity.	JB6Z8F	There is insufficient evidence to support the use of antibiotics in the management of preterm labour. Further research is required to determine the optimal antibiotic regimen.		
CD004611	There is insufficient evidence to recommend probiotic therapy as an adjunct to antibiotic therapy for C. difficile colitis. There is no evidence to support the use of probiotics alone in the treatment of C. difficile colitis.	VNCH8M	There is insufficient evidence to support the use of probiotics for recurrent Clostridium difficile disease.	SPNXTA	There is insufficient evidence to support the use of probiotics in patients with recurrent Clostridium difficile disease.		
CD003032	Although ethosuximide, lamotrigine and valproate are commonly used to treat people with absence seizures we have insufficient evidence to inform clinical practice, and the few trials included in this review were of poor methodological quality and did not have sufficient number of participants. More trials of better quality are needed.	PX7SGV	There is insufficient evidence from randomised controlled trials to support the use of melatonin for the treatment of epilepsy in children.	JB6Z8F	There is insufficient evidence to support the use of melatonin for the treatment of absence seizures in children and adolescents.		
CD003581	There is no evidence, either supporting or refuting the use of bed rest at home or in hospital, to prevent preterm birth. Although bed rest in hospital or at home is widely used as the first step of treatment, there is no evidence that this practice could be beneficial. Due to the potential adverse effects that bed rest could have on women and their families, and the increased costs for the healthcare system, clinicians should not routinely advise women to rest in bed to prevent preterm birth. Potential benefits and harms should be discussed with women facing an increased risk of preterm birth. Appropriate research is mandatory. Future trials should evaluate both the effectiveness of bed rest, and the effectiveness of the prescription of bed rest, to prevent preterm birth. [Note: The two citations in the awaiting classification section of the review may alter the conclusions of the review once assessed.]	VNCH8M	There is insufficient evidence to support or refute the use of preterm birth prevention education in high-risk women.	JB6Z8F	There is insufficient evidence to support or refute the effectiveness of preterm birth prevention education and increased clinic visits as primary interventions for reducing preterm birth.		
CD005083	Honey dressings do not increase rates of healing significantly in venous leg ulcers when used as an adjuvant to compression. Honey may delay healing in partial- and full-thickness burns in comparison to early excision and grafting, and in cutaneous Leishmaniasis when used as an adjuvant with meglumine antimoniate. Honey might be superior to some conventional dressing materials, but there is considerable uncertainty about the replicability and applicability of this evidence. There is insufficient evidence to guide clinical practice in other types of wounds, and health services may wish to consider avoiding routine use of honey dressings until sufficient evidence of effect is available.	JB6Z8F	There is insufficient evidence to support the use of honey as a wound dressing for wounds.	AQ85CE	There is insufficient evidence to support the use of honey for the treatment of acute postoperative wound infections. Further research is needed.		
CD002873	There is no clear benefit of using b2-agonists in the management of recurrent wheeze in the first two years of life although there is conflicting evidence. At present, further studies should only be performed if the patient group can be clearly defined and there is a suitable outcome parameter capable of measuring a response.	AQ85CE	There is insufficient evidence to support or refute the use of facemasks in the management of wheeze in infants. Further research is needed to determine the role of facembolism in the treatment of wheezing infants.	SPNXTA	There is no evidence that nebulised salbutamol improves wheezy infants' clinical status or airway obstruction. There is evidence that it may reduce the severity of cough and increase functional improvement. There was no evidence of a protective effect of nebulized salbutAMol on wheeze severity.		
CD007986	Overall, there is little evidence that PUFA supplementation provides any benefit for the symptoms of ADHD in children and adolescents. The majority of data showed no benefit of PUFA supplementation, although there were some limited data that did show an improvement with combined omega-3 and omega-6 supplementation. It is important that future research addresses current weaknesses in this area, which include small sample sizes, variability of selection criteria, variability of the type and dosage of supplementation, short follow-up times and other methodological weaknesses.	AQ85CE	There is no evidence to support the use of omega-3 fatty acids in the treatment of ADHD or hyperactivity.	SPNXTA	There is currently no evidence to support the use of PUFA in children with ADHD. There is a need for further well-designed RCTs with adequate power and long-term follow-up.		
CD002815	Considering the small number of patients examined, the methodological flaws in many of the studies and the possibility of publication bias, there is insufficient evidence to support or refute the efficacy of any given form of physiotherapy over another in Parkinson's disease. Another Cochrane review, Physiotherapy for patients with Parkinson's Disease, found that there was insufficient evidence to support or refute the efficacy of physiotherapy compared to no physiotherapy in Parkinson's disease.  A wide range of physiotherapy approaches were used in these studies and a survey of UK physiotherapists confirmed that they also use an eclectic combination of techniques in the treatment of Parkinson's disease (Plant 1999). Therefore a consensus must be found as to 'best practice' physiotherapy for Parkinson's disease. The efficacy of 'standard' physiotherapy should be proved first before examining variations in physiotherapy methods. Therefore large well designed randomised controlled trials are needed to judge the effect of physiotherapy in Parkinson's disease. After this large RCTs are needed to demonstrate the most effective form of physiotherapy in Parkinson's disease. Outcome measures with particular relevance to patients, carers, physiotherapists and physicians should be chosen and the patients monitored for at least 6 months to determine the duration of any effect. The trials should be reported according to CONSORT guidelines (CONSORT 1996).	PX7SGV	There is insufficient evidence from randomised controlled trials to support or refute the use of RAS in the rehabilitation of people with Parkinson's disease.	8FWF5T	There is insufficient evidence to support or refute the use of music-based interventions for people with idiopathic myasthenia gravis. The research should focus on the use of music-based interventions for people with idiopathic myasthenia gravis.		
CD005042	Further research examining the effectiveness of family therapy versus a no-treatment control condition is needed to determine whether family therapy is an effective intervention for children with ADHD. There were no results available from studies investigating forms of family therapy other than behavioural family therapy.	AQ85CE	The available evidence suggests that psychostimulants are effective in treating ADHD in children and adolescents. However, the quality of the evidence is poor. The majority of studies were small and of poor methodological quality. There is a need for more high quality, well-designed, adequately powered, well reported and reported studies.	JB6Z8F	There is insufficient evidence to support the use of combination therapy for ADHD.		
CD005568	Due to the generally low methodological quality and small sample size of the included trials in this systematic review, we could not draw a firm conclusion.	PX7SGV	There is insufficient evidence from randomised controlled trials to support the routine use of Erigeron injection in the treatment of patients with acute cerebral infarction.	AQ85CE	There is insufficient evidence to support the routine use of Erigeron in patients with acute ischaemic stroke.		
CD005208	There is currently not enough evidence from randomised controlled trials regarding the efficacy or safety of GP IIb-IIIa inhibitors therapy in acute ischaemic stroke. Results from ongoing trials will help to understand the risk to benefit ratio of these agents.	PX7SGV	Thereciximab appears to be effective in the treatment of acute ischaemic stroke. However, there is a need for further well-designed randomised controlled trials in this area.	VNCH8M	There is currently insufficient evidence to support the use of abciximab for acute ischemic stroke.		
CD003231	The data from the present meta-analysis indicate that tumour recurrence was significantly reduced with intravesical BCG compared to MMC only in the subgroup of patients at high risk of tumour recurrence. However, there was no difference in terms of disease progression or survival, and the decision to use either agent might be based on adverse events and cost.	SPNXTA	There is insufficient evidence from randomised controlled trials to determine whether intravesical therapy is more or less effective than immunotherapy in the treatment of recurrent bladder cancer. Further well-designed randomised trials are required to answer this question.	JB6Z8F	There is insufficient evidence to support the use of any particular type of intravesical chemotherapy for bladder cancer.		
CD000369	Interferon alfa is effective in improving biochemical outcomes and achieving sustained virologic clearance in patients with transfusion-acquired acute hepatitis C. The effect on long-term clinical outcomes could not be assessed due to limitations in the current data.	SPNXTA	There is insufficient evidence to recommend the use of interferon for the treatment of acute hepatitis C.	JB6Z8F	There is insufficient evidence to support the use of interferon-alpha in acute hepatitis C. Further randomised controlled trials are needed to determine the efficacy of interferon-alpha in acute hepatitis C.		
CD001340	A policy of using ECMO in mature infants with severe but potentially reversible respiratory failure results in significantly improved survival without increased risk of severe disability. The benefit of ECMO for babies with diaphragmatic hernia is unclear. Further studies are needed to consider the optimal timing for introducing ECMO; to identify which infants are most likely to benefit; and to address the implications of neonatal ECMO during later childhood and adult life.	JB6Z8F	There is insufficient evidence to support the routine use of ECMO in neonates with severe pulmonary hypertension.	VNCH8M	There is insufficient evidence to support or refute the use of ECMO in neonates with severe respiratory failure.		
CD002783	Thrombolysis appears to offer advantages in terms of reducing post-thrombotic syndrome and maintaining venous patency after DVT. Use of strict eligibility criteria has improved the safety and acceptability of this treatment. The optimum drug, dose and route of administration have yet to be determined.	VNCH8M	Thrombolytic therapy is effective in the treatment of acute DVT. However, the long-term effects of thrombolytic therapy are not known.	8FWF5T	There is insufficient evidence to support the use of streptokinase in the treatment of deep vein thrombosis. The evidence is insufficient to support the use of streptokinase in the treatment of deep vein thrombosis.		
CD006956	Laparoscopic surgery for small bowel CD may be as safe as the open operation. There was no significant difference in the perioperative outcomes and the long term reoperation rates for disease-related or non-disease related complications of CD.	VNCH8M	There is no evidence to support the use of laparoscopic ileocolic resection for Crohn's disease.	8FWF5T	There is insufficient evidence to support the use of laparoscopic surgery for the treatment of ileocolic disease. The results of this review suggest that laparoscopic surgery may be superior to open surgery in terms of postoperative recovery, length of hospital stay, and length of hospital stay. The results of this review suggest that laparoscopic surgery may be superior to open surgery in terms of postoperative recovery, length of hospital stay, and length of hospital stay.		
CD003937	There is insufficient evidence to support the use of herbal medicines in HIV-infected individuals and AIDS patients. Potential beneficial effects need to be confirmed in large, rigorous trials.	SPNXTA	There is insufficient evidence to support or refute the use of Chinese medicinal herbs for the management of diarrhoea.	VNCH8M	There is insufficient evidence to support the use of Chinese medicinal herbs for the treatment of symptomatic diarrhea in HIV-infected individuals.		
CD006639	Evidence on whether zinc supplementation can reduce the incidence of OM in healthy children under the age of five years living in low- and middle-income countries is mixed. There is some evidence of benefit in children being treated for marasmus (severe malnutrition) but this is based on one small trial and should therefore be treated with caution.	PX7SGV	There is insufficient evidence from randomised controlled trials to support the routine use of zinc supplementation in children. Further trials are needed.	AQ85CE	Zinc supplementation in children with persistent diarrhoea significantly reduces the risk of death and morbidity from diarrhoeas. The effect of zinc supplementation on morbidity and growth is modest. The evidence is not strong enough to recommend routine zinc supplementation in the prevention of severe diarrhoeae.		
CD001342	For the secondary prevention of recurrent ischemic stroke after TIA or minor stroke of presumed arterial origin, there is sufficient evidence to conclude that vitamin K antagonists in any dose are not more efficacious than antiplatelet therapy and that medium and high intensity anticoagulation leads to a significant increase in major bleeding complications.	AQ85CE	Oral anticoagulants are effective in preventing vascular events in patients with transient ischaemic stroke and minor ischaemia. However, the evidence is limited. The effect of oral anticoagenics on mortality and major vascular events is unknown.	JB6Z8F	There is insufficient evidence to support the use of oral anticoagulants for the prevention of stroke in patients with TIA.		
CD002265	This systematic review found one randomised controlled trial with a small number of patients in the different clinical subgroups of neurological manifestation. There is very low-quality evidence that cyclophosphamide is more effective in reducing symptoms of neuropsychiatric involvement in SLE compared with methylprednisolone. However, properly designed randomised controlled trials that involve large numbers of individuals, with explicit clinical and laboratory diagnostic criteria, sufficient duration of follow-up and description of all relevant outcome measures, are necessary to guide practice. As we did not find any new trials to include in this review at update, the conclusions of the review did not change.	VNCH8M	There is insufficient evidence to determine whether cyclophosphamide is more effective than methylprednisolone in the treatment of severe neurological complications in NPSLE.	AQ85CE	There is insufficient evidence to support the use of corticosteroids in the treatment of SLE. The available evidence suggests that corticolic steroids may be effective in reducing the number of seizures and improving muscle strength and disability in patients with SLE, but the quality of the evidence is poor. There is a need for further well-designed, adequately powered, randomised controlled trials to determine the optimal dose and duration of cortical steroids in the management of Sle.		
CD008493	Preoperative statin therapy reduces the odds of post-operative AF and shortens the stay on the ICU and in the hospital. Statin pretreatment had no influence on perioperative mortality, stroke, myocardial infarction or renal failure. Since analysed studies included mainly patients undergoing myocardial revascularizations the results cannot be extrapolated to patients undergoing other cardiac procedures such as heart valve or aortic surgery.	PX7SGV	The available evidence does not support the routine use of statins in the treatment of patients with cardiopulmonary bypass. There is a need for further well-designed randomised controlled trials.	VNCH8M	There is no evidence to support the use of preoperative statins in the prevention of postoperative AF in patients undergoing elective coronary bypass grafting surgery.		
CD006616	Overall, this meta-analysis puts doubt on the safety and utility of intravenous N-acetylcysteine as an adjuvant therapy in SIRS and sepsis. At best, N-acetylcysteine is ineffective in reducing mortality and complications in this patient population. At worst, it can be harmful, especially when administered later than 24 hours after the onset of symptoms, by causing cardiovascular depression. Unless future RCTs provide evidence of treatment effect, clinicians should not routinely use intravenous N-acetylcysteine in SIRS or sepsis and academics should not promote its use.	SPNXTA	There is no evidence that antioxidant therapy in patients with acute lung injury reduces mortality or morbidity, but there is evidence that it may reduce the need for mechanical ventilation.	8FWF5T	There is insufficient evidence to support the use of glutathione-acetylcysteine in the treatment of patients with severe sepsis. The evidence is limited, and the results are not consistent. The is insufficient evidence to determine whether glutathione-acetylcysteine is beneficial or harmful in the treatment of patients with severe sepsis.		
CD006866	Oral acyclovir did not reduce the incidence of PHN significantly. There is insufficient evidence from randomised controlled trials to determine whether other antiviral treatments prevent PHN. Additional well-designed, randomised controlled trials of famciclovir or other new antiviral agents, with a greater number of participants are needed. Future trials should pay more attention to the severity of pain and quality of life of participants, and should be conducted among different subgroups of people, such as people who are immunocompromised.	PX7SGV	Thereral acyclovir appears to be effective in the treatment of acute herpes zoster. There is insufficient evidence from randomised controlled trials to support its use in clinical practice.	8FWF5T	There is insufficient evidence to support the use of acyclovir for the treatment of herpes zoster. The evidence is insufficient to support the use of acyclovir for the treatment of herpes zoster. The evidence is insufficient to support the use of acyclovir for the treatment of herpes zoster.		
