review_id,target,sys_a,A,sys_b,B
CD008112,"High quality evidence suggests that there is no clinically relevant difference between SMT and other interventions for reducing pain and improving function in patients with chronic low-back pain. Determining cost-effectiveness of care has high priority. Further research is likely to have an important impact on our confidence in the estimate of effect in relation to inert interventions and sham SMT, and data related to recovery.",VNCH8M,"There is some evidence that chiropractic is an effective treatment for chronic LBP. However, the evidence is not strong enough to recommend chiropractic as the preferred treatment for LBP.",AQ85CE,There is insufficient evidence to support the use of back school as a treatment for subacute LBP.
CD006667,There is not evidence to make conclusions on whether recruitment manoeuvres reduce mortality or length of ventilation in patients with ALI or ARDS.,8FWF5T,There is insufficient evidence to support the use of recruitment manoeuvres to reduce mortality in patients with acute lung injury.,AQ85CE,"There is insufficient evidence to support or refute the use of lung recruitment manoeuvres in mechanically ventilated patients with CLD. Further randomised controlled trials are needed to determine the role of lung recruitments in the treatment of CLD, and to assess the safety of these manoeuvres."
CD007771,The evidence base for the use of vitamin D for chronic pain in adults is poor at present. This is due to low quality and insufficient randomised controlled trials in this area of research.,AQ85CE,Alfacalcidol is effective in the treatment of RA. Its adverse effects are mild and probably not life threatening.,VNCH8M,There is insufficient evidence to support or refute the use of vitamin D for the prevention of rheumatoid arthritis.
CD002752,"Amongst CHF patients who have previously been admitted to hospital for this condition there is now good evidence that case management type interventions led by a heart failure specialist nurse reduces CHF related readmissions after 12 months follow up, all cause readmissions and all cause mortality.  It is not possible to say what the optimal components of these case management type interventions are, however telephone follow up by the nurse specialist was a common component.
Multidisciplinary interventions may be effective in reducing both CHF and all cause readmissions. There is currently limited evidence to support interventions whose major component is follow up in a CHF clinic.",8FWF5T,There is some evidence that outpatient management programs reduce hospital admissions and readmissions in patients with heart failure. The is no evidence that these interventions reduce mortality or morbidity. The is some evidence that outpatient management programs reduce the number of hospital admissions and readmissions in patients with heart failure. The evidence is insufficient to determine whether these interventions reduce mortality or morbidity.,VNCH8M,Nurse-led programmes for patients with heart failure reduce hospitalisation and mortality. The effects of nurse-led programmes on quality of life and cost are unclear.
CD003472,"The evidence that exercise therapy is more effective in treating PFPS than no exercise was limited with respect to pain reduction, and conflicting with respect to functional improvement. There is strong evidence that open and closed kinetic chain exercise are equally effective. Further research to substantiate the efficacy of exercise treatment compared to a non-exercising control group is needed, and thorough consideration should be given to methodological aspects of study design and reporting.",SPNXTA,There is insufficient evidence from randomised controlled trials to draw conclusions about the relative effectiveness of exercise programmes for patellofemoral pain syndrome.,AQ85CE,There is insufficient evidence to support or refute the effectiveness of closed kinetic chain training compared with no treatment or other forms of exercise for patellofemoral pain.
CD008361,"We could not find convincing evidence that NBI is significantly better than high definition WLC for the detection of patients with colorectal polyps, or colorectal adenomas. We found evidence that NBI might be better than standard definition WLC and equal to high definition WLC for detection the patients with colorectal polyps, or colorectal adenomas.",8FWF5T,There is insufficient evidence to support the use of adenoid coloscopy for the detection of colonic adenomas. The results of this review suggest that the use of adenoid coloscopy is associated with a significant increase in the detection of colonic adenomas. The results of this review suggest that the use of adenoid coloscopy is associated with a significant increase in the detection of colonic adenomas.,SPNXTA,"The use of NBI compared with white light did not significantly improve the neoplasm detection rate. However, NBI was associated with an increased risk of non-polypoid adenoma, which may have an important role in the screening of colorectal neoplasias."
CD003804,There is no convincing evidence relating type or intensity of diabetic treatment to the prevention or management of cognitive impairment in Type II diabetes. Future research on treatments for diabetes should include standardized assessments of cognitive function as outcome measures.,AQ85CE,There is insufficient evidence to support the use of ginseng in the treatment of type 2 diabetes mellitus.,JB6Z8F,There is insufficient evidence to support or refute the use of ginseng therapy for improving cognitive function in patients with type 2 diabetes mellitus.
CD002231,"Based on one low quality trial, the medicinal herb 'Jianpi Wenshen recipe' may have an antiviral activity in asymptomatic carriers of hepatitis B virus. However, rigorous randomised, double-blind, placebo-controlled trials are needed before herbs should be used for this condition.",SPNXTA,The efficacy of Phyllanthus amarus for the treatment of asymptomatic hepatitis B virus carriers remains unclear. The plant appears to be of no benefit in preventing the spread of hepatitis B viruses to other populations.,JB6Z8F,Phyllanthus amarus is effective in the treatment of chronic hepatitis B virus carriers.
CD000436,"This review did not find any evidence that dietary sodium reduction significantly improves asthma control. Although dietary sodium reduction may result in improvements in lung function in exercise-induced asthma, the clinical significance of this effect is unclear.",AQ85CE,There is insufficient evidence to support or refute the use of dietary salt reduction for the treatment of asthma. The effect of salt reduction on asthma symptoms and on lung function remains uncertain.,8FWF5T,There is insufficient evidence to support the use of low-salt diets in people with asthma. The is insufficient evidence to support the use of low-salt diets in people with asthma.
CD003231,"The data from the present meta-analysis indicate that tumour recurrence was significantly reduced with intravesical BCG compared to MMC only in the subgroup of patients at high risk of tumour recurrence. However, there was no difference in terms of disease progression or survival, and the decision to use either agent might be based on adverse events and cost.",SPNXTA,There is insufficient evidence from randomised controlled trials to determine whether intravesical therapy is more or less effective than immunotherapy in the treatment of recurrent bladder cancer. Further well-designed randomised trials are required to answer this question.,PX7SGV,There is insufficient evidence to support or refute the use of immunomodulators in the treatment of superficial bladder cancer.
CD010292,"The SNRIs duloxetine and milnacipran provided a small incremental benefit over placebo in reducing pain. The superiority of duloxetine and milnacipran over placebo in reducing fatigue and limitations of QOL was not substantial. Duloxetine and milnacipran were not superior to placebo in reducing sleep problems. The dropout rates due to adverse events were higher for duloxetine and milnacipran than for placebo. The most frequently reported symptoms leading to stopping medication were nausea, dry mouth, constipation, headache, somnolence/dizziness and insomnia. Rare complications of both drugs may include suicidality, liver damage, abnormal bleeding, elevated blood pressure and urinary hesitation.",AQ85CE,There is insufficient evidence to support the use of antidepressants in the treatment of pain in fibromyalgia.,SPNXTA,Duloxetine and milnacipran 60 mg and 120 mg daily are effective and safe treatments for the treatment of pain associated with fibromyalgia.
CD000143,"Implications for practice: nasal CPAP is effective in preventing failure of extubation in preterm infants following a period of endotracheal intubation and IPPV.
Implication for research: further definition of the gestational age and weight groups in whom these results apply is warranted. Optimal levels of NCPAP as well as methods of administration remain to be determined.",JB6Z8F,There is insufficient evidence to support the use of NCPAP to prevent the need for re-intubation of preterm infants who are extubated from mechanical ventilation.,VNCH8M,There is no evidence to support the use of NCPAP for elective extubation of preterm infants.
CD002282,"It is difficult to draw any conclusions from this review, however, suggestions are made for methods of improving future research involving orthodontic adhesives.",JB6Z8F,There is insufficient evidence to support or refute the use of GIC for orthodontic bonding.,8FWF5T,There is insufficient evidence to support the use of any particular bonding agent for orthodontic brackets. The is insufficient evidence to determine whether the use of a particular bonding agent is associated with a reduced risk of bracket debonding. The evidence is insufficient to determine whether the use of a particular bonding agent is associated with a reduced risk of bracket debonding.
CD005237,"We know very little of the effects of these drugs regarding service outcomes, general functioning and behaviours, engagement with services and treatment satisfaction from evaluative studies. There was generally a high rate of attrition in the trials and there appears to be little to differentiate between risperidone and olanzapine except on issues of adverse effects. Both drugs are associated with a reduction in psychotic symptoms but both commonly cause unpleasant adverse effects.",AQ85CE,"Clozapine may be more effective than placebo in the treatment of schizophrenia, but its adverse effects are similar to those of other atypical drugs. Its adverse effects profile is similar to that of typical antipsychotics, with its tendency to induce weight gain and sedation.",8FWF5T,There is insufficient evidence to support the use of risperidone in the treatment of schizophrenia. The evidence is insufficient to support the use of risperidone in the treatment of schizophrenia. The is insufficient evidence to support the use of risperidone in the treatment of schizophrenia.
CD003421,These results suggest that calcium channel blockers given in the peri-operative period may reduce the incidence of ATN post-transplantation. The result should be treated with caution due to the heterogeneity of the trials which made comparison of studies and pooling of data difficult.,VNCH8M,There is evidence that calcium antagonists reduce the risk of tubular necrosis in kidney transplantation recipients. There is no evidence that calcium antagonists reduce the risk of graft rejection.,PX7SGV,There is insufficient evidence from randomised controlled trials to support or refute the use of calcium antagonists in patients undergoing cadaveric kidney transplantation.
CD003472,"The evidence that exercise therapy is more effective in treating PFPS than no exercise was limited with respect to pain reduction, and conflicting with respect to functional improvement. There is strong evidence that open and closed kinetic chain exercise are equally effective. Further research to substantiate the efficacy of exercise treatment compared to a non-exercising control group is needed, and thorough consideration should be given to methodological aspects of study design and reporting.",JB6Z8F,There is insufficient evidence to support the use of closed kinetic chain exercises for patellofemoral pain.,PX7SGV,There is insufficient evidence from randomised controlled trials to support or refute the use of electromyography for the treatment of patellofemoral pain.
CD002896,"VNS for partial seizures appears to be an effective and well tolerated treatment. Adverse effects of hoarseness, cough, pain, paresthesias, and dyspnea are associated with the treatment but appear to be reasonably well tolerated as dropouts were rare. Typical central nervous system adverse effects of antiepileptic drugs such as ataxia, dizziness, fatigue, nausea, and somnolence were not statistically significantly associated with VNS treatment.",8FWF5T,There is insufficient evidence to support the use of high-frequency axon stimulation for the treatment of partial epilepsy. The is insufficient evidence to support the use of high-frequency axon stimulation for the treatment of partial epilepsy.,AQ85CE,There is insufficient evidence to support the use of high-frequency VNS stimulation in the treatment of epilepsy.
CD006170,"The most suitable method for milk expression may depend on the time since birth, purpose of expression and the individual mother and infant. Low cost interventions including early initiation when not feeding at the breast, relaxation, hand expression and lower cost pumps may be as effective, or more effective, than large electric pumps for some outcomes. Small sample sizes, large standard deviations, small number of studies reviewed, and the diversity of the interventions argue caution in applying these results beyond the specific method tested in the specific settings.",PX7SGV,There is insufficient evidence from randomised controlled trials to support or refute the use of different methods of breast feeding for preterm infants. Further research is needed.,8FWF5T,There is insufficient evidence to support the use of a single- or double-breast pump to achieve adequate milk production. The results suggest that the use of a single- or double-breast pump may be beneficial for mothers and infants. The results also suggest that the use of a single- or double-breast pump may be beneficial for mothers. The is insufficient evidence to recommend the use of a single- or double-breast pump to achieve adequate milk production.
CD008391,"We identified insufficient high-quality evidence to reach any generalised conclusions about the effect of cognitive rehabilitation on executive function, or other secondary outcome measures. Further high-quality research comparing cognitive rehabilitation with no intervention, placebo or sensorimotor interventions is recommended.",PX7SGV,There is insufficient evidence to support or refute the effectiveness of cognitive rehabilitation for people with acquired brain injury. Further research is needed.,VNCH8M,"Multidisciplinary cognitive rehabilitation is an effective treatment for people with TBI. However, the evidence for the effectiveness of multidisciplinary cognitive rehabilitation for people with TBI is limited."
CD008493,"Preoperative statin therapy reduces the odds of post-operative AF and shortens the stay on the ICU and in the hospital. Statin pretreatment had no influence on perioperative mortality, stroke, myocardial infarction or renal failure. Since analysed studies included mainly patients undergoing myocardial revascularizations the results cannot be extrapolated to patients undergoing other cardiac procedures such as heart valve or aortic surgery.",PX7SGV,The available evidence does not support the routine use of statins in the treatment of patients with cardiopulmonary bypass. There is a need for further well-designed randomised controlled trials.,JB6Z8F,There is insufficient evidence to support or refute the use of statins for the prevention of postoperative AF in patients undergoing elective CABG.
CD003412,"Overall there has been very little good quality research on treatments for BCC. Most trials have only evaluated BCCs in low risk locations. Surgery and radiotherapy appear to be the most effective treatments with surgery showing the lowest failure rates. Although cosmetic outcomes appear good with PDT, long-term follow-up data are needed. Other treatments might have some use but few have been compared to surgery. An ongoing study comparing imiquimod to surgery should clarify whether imiquimod is a useful option.",AQ85CE,"Imiquimod 5% cream appears to be more effective than placebo in the treatment of patients with Basal cell carcinoma. However, the evidence is based on a small number of patients and the quality of the evidence was poor. The quality of evidence for other topical treatments was poor, and the number of participants in the included trials was small. There is a need for more RCTs to evaluate the efficacy of topical imiquimid 5% in the management of Basal Cell carcinoma, and to compare it with other topical therapies.",VNCH8M,"Interferon s are effective in the treatment of superficial basal cell carcinoma. However, the evidence is limited by the small number of studies and the small sample sizes. There is insufficient evidence to recommend the use of interferon s for the treatment of patients with BCC."
CD002068,There is evidence to support the effectiveness of bisphosphonates in providing some pain relief for bone metastases. There is insufficient evidence to recommend bisphosphonates for immediate effect; as first line therapy; to define the most effective bisphosphonates or their relative effectiveness for different primary neoplasms. Bisphosphonates should be considered where analgesics and/or radiotherapy are inadequate for the management of painful bone metastases.,SPNXTA,"Bisphosphonates are effective in reducing pain, improving function, and reducing the need for analgesics in patients with metastatic bone disease.",PX7SGV,There is insufficient evidence from randomised controlled trials to determine whether bisphosphonates are effective in the treatment of bone pain in patients with metastatic cancer.
CD000246,"This review fails to demonstrate a clear overall benefit from prophylactic antibiotic treatment for preterm labour with intact membranes on neonatal outcomes and raises concerns about increased neonatal mortality for those who received antibiotics. This treatment cannot therefore be currently recommended for routine practice. Further research may be justified (when sensitive markers for subclinical infection become available) in order to determine if there is a subgroup of women who could experience benefit from antibiotic treatment for preterm labour prior to membrane rupture, and to identify which antibiotic or combination of antibiotics is most effective.
[Note: The 17 citations in the awaiting classification section of the review may alter the conclusions of the review once assessed.]",VNCH8M,"There is insufficient evidence to recommend the use of antibiotics for women with intact membranes. Further research is needed to determine whether there is a benefit in terms of preterm birth, or whether there is a reduction in neonatal morbidity.",JB6Z8F,There is insufficient evidence to support the use of antibiotics in the management of preterm labour. Further research is required to determine the optimal antibiotic regimen.
CD009202,"There is lack of robust and randomised controlled evidence that can clarify the efficacy of propofol and thiopental sodium over each other in the treatment of RSE. There is a need for large, randomised controlled trials for this serious condition.",AQ85CE,There is insufficient evidence to support the use of propofol for the treatment of refractory status epilepticus.,PX7SGV,There is insufficient evidence to support or refute the use of barbiturates for the treatment of refractory status epilepticus.
CD006170,"The most suitable method for milk expression may depend on the time since birth, purpose of expression and the individual mother and infant. Low cost interventions including early initiation when not feeding at the breast, relaxation, hand expression and lower cost pumps may be as effective, or more effective, than large electric pumps for some outcomes. Small sample sizes, large standard deviations, small number of studies reviewed, and the diversity of the interventions argue caution in applying these results beyond the specific method tested in the specific settings.",VNCH8M,There is insufficient evidence to support the use of breast pumps for women who wish to continue breastfeeding their infants. Further research is needed.,JB6Z8F,There is insufficient evidence to support the use of any particular pump type or method for breast milk production in preterm infants. Further research is required to determine the optimal pump type and method for breast milk production in preterm infants.
CD007350,The results of one well designed study using lenalidomide did not show any statistically significant benefit over placebo. The use of thalidomide or lenalidomide for induction of remission in Crohn's disease is not recommended until data from a definitive study are available.,JB6Z8F,There is insufficient evidence to support the use of thalidomide for the treatment of active Crohn's disease.,8FWF5T,There is insufficient evidence to support the use of thalidomide in the treatment of patients with advanced or metastatic myelodysplastic syndrome. The evidence is insufficient to support the use of thalidomide in the treatment of patients with advanced or metastatic myelodysplastic syndrome.
CD004668,"Although DBT and FSHT were better than no treatment when used in combination with an alarm, there was insufficient evidence to support their use without an alarm. An alarm on its own was also better than DBT on its own, but there was some evidence that combining an alarm with DBT was better than an alarm on its own, suggesting that DBT may augment the effect of an alarm. There was also some evidence that direct contact with a therapist might enhance the effects of an intervention.",JB6Z8F,There is insufficient evidence to support the use of dry bed training as a treatment for children with nocturnal enuresis.,PX7SGV,There is insufficient evidence from randomised controlled trials to support or refute the use of dry bed training for children with nocturnal enuresis.
CD005542,"There is little evidence to support the use of one particular form of insulin administration over another for pregnant women with diabetes. The data are few, there are only a small number of trials appropriate for meta-analysis, a small number of women included and questionable generalisability of the trial population. Conclusions cannot be made from the available data. Well-designed randomised trials are needed. These trials should be adequately powered to assess the effect of CSII versus MDI on important outcomes for women with diabetes and their infants.",PX7SGV,There is insufficient evidence from randomised controlled trials to support or refute the use of CSII for women with type 1 diabetes mellitus.,SPNXTA,There is insufficient evidence from randomised controlled trials to determine whether enhanced insulin therapy is superior or inferior to other forms of insulin therapy for pregnant women with type 1 diabetes. Further trials are needed to evaluate the comparative effectiveness of enhanced insulin and micropump therapy for type 2 diabetes mellitus.
CD009461,"Hysteroscopic myomectomy might increase the odds of clinical pregnancy in women with unexplained subfertility and submucous fibroids, but the evidence is at present not conclusive. The hysteroscopic removal of endometrial polyps suspected on ultrasound in women prior to IUI might increase the clinical pregnancy rate. More randomised studies are needed to substantiate the effectiveness of the hysteroscopic removal of suspected endometrial polyps, submucous fibroids, uterine septum or intrauterine adhesions in women with unexplained subfertility or prior to IUI, IVF or ICSI.",VNCH8M,There is insufficient evidence to support the use of hysteroscopic polypectomy before IUI for women with endometrial polyps.,JB6Z8F,There is insufficient evidence to support the use of hysteroscopic polypectomy before IUI for women with endometrial polyps.
CD002896,"VNS for partial seizures appears to be an effective and well tolerated treatment. Adverse effects of hoarseness, cough, pain, paresthesias, and dyspnea are associated with the treatment but appear to be reasonably well tolerated as dropouts were rare. Typical central nervous system adverse effects of antiepileptic drugs such as ataxia, dizziness, fatigue, nausea, and somnolence were not statistically significantly associated with VNS treatment.",8FWF5T,There is insufficient evidence to support the use of high-frequency axon stimulation for the treatment of partial epilepsy. The is insufficient evidence to support the use of high-frequency axon stimulation for the treatment of partial epilepsy.,PX7SGV,There is insufficient evidence from randomised controlled trials to determine whether Vagus nerve stimulation is an effective treatment for epilepsy. Further trials are needed.
