review_id,target,sys_a,A,sys_b,B
CD001059,"Calcium supplementation appears to approximately halve the risk of pre-eclampsia, to reduce the risk of preterm birth and to reduce the occurrence of the composite outcome 'death or serious morbidity'. We considered the latter benefit to outweigh the increase in HELLP syndrome, which was small in absolute numbers. There were no other clear benefits, or harms.",PX7SGV,There is insufficient evidence to determine whether calcium supplementation during pregnancy reduces the risk of pre-eclampsia or preterm birth.,AQ85CE,There is insufficient evidence to support the use of calcium supplementation during pregnancy to reduce the risk of pre-eclampsia.
CD001943,Loxapine is an antipsychotic which is not clearly distinct from typical or atypical drugs in terms of its effects on global or mental state. Loxapines profile of adverse effects is similar to that of the older generation of antipsychotic drugs.,JB6Z8F,There is insufficient evidence to support the use of loxapine for the treatment of schizophrenia.,SPNXTA,"Loxapine appears to be an effective treatment for those with schizophrenia. However, there is insufficient evidence to conclude that it is superior to other commonly used antipsychotic drugs."
CD007414,"There is no evidence to suggest that the use of platinum agents, doxorubicin or paclitaxel used as maintenance chemotherapy is more effective than observation alone. Further investigations regarding the effect of paclitaxel used as maintenance chemotherapy are required.",JB6Z8F,There is insufficient evidence to support or refute the use of chemotherapy with or without topotecan for women with advanced ovarian cancer.,SPNXTA,Topotecan alone or in combination with chemotherapy or radiotherapy does not appear to improve overall survival or progression-free survival in women with advanced epithelial ovarian cancer.
CD006505,"Inactivated VZV vaccine might reduce zoster severity in adult SCT recipients. Inactivated influenza vaccine might reduce respiratory infections and hospitalization in adults with multiple myeloma or children with leukemia or lymphoma. However, the quality of evidence is low. Local adverse effects occur frequently. Further high-quality RCTs are needed.",VNCH8M,There is insufficient evidence to support or refute the use of influenza vaccine in patients with cancer.,JB6Z8F,There is insufficient evidence to support the routine use of influenza vaccine in children with cancer.
CD007214,There is only limited evidence that TENS reduces pain in labour and it does not seem to have any impact (either positive or negative) on other outcomes for mothers or babies. The use of TENS at home in early labour has not been evaluated. TENS is widely available in hospital settings and women should have the choice of using it in labour.,8FWF5T,There is insufficient evidence to support the use of cutaneous nerve stimulation for pain relief during labour and delivery. The is insufficient evidence to support the use of cutaneous nerve stimulation for pain relief during labour and delivery.,SPNXTA,There is insufficient evidence to support the use of TENS for pain relief in labour.
CD002068,There is evidence to support the effectiveness of bisphosphonates in providing some pain relief for bone metastases. There is insufficient evidence to recommend bisphosphonates for immediate effect; as first line therapy; to define the most effective bisphosphonates or their relative effectiveness for different primary neoplasms. Bisphosphonates should be considered where analgesics and/or radiotherapy are inadequate for the management of painful bone metastases.,JB6Z8F,There is insufficient evidence to support the use of pamidronate for the treatment of bone pain in patients with metastatic bone disease.,SPNXTA,"Bisphosphonates are effective in reducing pain, improving function, and reducing the need for analgesics in patients with metastatic bone disease."
CD000246,"This review fails to demonstrate a clear overall benefit from prophylactic antibiotic treatment for preterm labour with intact membranes on neonatal outcomes and raises concerns about increased neonatal mortality for those who received antibiotics. This treatment cannot therefore be currently recommended for routine practice. Further research may be justified (when sensitive markers for subclinical infection become available) in order to determine if there is a subgroup of women who could experience benefit from antibiotic treatment for preterm labour prior to membrane rupture, and to identify which antibiotic or combination of antibiotics is most effective.
[Note: The 17 citations in the awaiting classification section of the review may alter the conclusions of the review once assessed.]",JB6Z8F,There is insufficient evidence to support the use of antibiotics in the management of preterm labour. Further research is required to determine the optimal antibiotic regimen.,AQ85CE,There is insufficient evidence to support the routine use of oral clindamycin in the treatment of preterm labour.
CD003051,"Surgical sealants reduce postoperative air leaks and time to chest drain removal but this reduction is not always associated with a reduction in length of postoperative hospital stay. Therefore, systematic use of surgical sealants with the objective of reducing hospital stay cannot be recommended at the moment. More and larger randomized controlled clinical trials are needed.",JB6Z8F,There is insufficient evidence to support the use of any intervention to reduce the incidence of postoperative air leaks following lung resection.,VNCH8M,There is no evidence to support the use of any intervention to reduce the incidence of postoperative air leaks.
CD007289,"P-Chem may reduce the risk of progression to GTN in women with CMs who are at a high risk of malignant transformation; however, current evidence in favour of P-Chem is limited by the poor methodological quality and small size of the included studies. As P-Chem may increase drug resistance, delay treatment of GTN and expose women unnecessarily to toxic side effects, this practice cannot currently be recommended.",8FWF5T,There is insufficient evidence to recommend the use of prophylactic chemotherapy for patients with persistent trophoblastic disease. The results suggest that prophylactic chemotherapy may be beneficial in patients at high risk of developing secondary malignancy. The is a need for well-designed randomised controlled trials to determine the optimal prophylactic chemotherapy for patients with persistent trophoblastic disease.,VNCH8M,There is insufficient evidence to support or refute the use of chemotherapy for patients with complete hydatidiform mole.
CD003472,"The evidence that exercise therapy is more effective in treating PFPS than no exercise was limited with respect to pain reduction, and conflicting with respect to functional improvement. There is strong evidence that open and closed kinetic chain exercise are equally effective. Further research to substantiate the efficacy of exercise treatment compared to a non-exercising control group is needed, and thorough consideration should be given to methodological aspects of study design and reporting.",8FWF5T,"isokinetic muscle training appears to be more effective than other types of exercise for improving pain and function in patients with patellofemoral pain. The evidence is limited, however, and further research is needed.",PX7SGV,There is insufficient evidence from randomised controlled trials to support or refute the use of electromyography for the treatment of patellofemoral pain.
CD002964,"Variation in the measures used, the included populations and interventions, and the risk of bias within the included studies limit the conclusions that can be reached. The findings provide some evidence to suggest that parenting programmes may be effective in improving a number of aspects of parent-child interaction both in the short- and long-term, but further research is now needed.",SPNXTA,"There is some evidence to suggest that culturally sensitive videotape may be beneficial for improving parent-infant interaction. However, the evidence is too limited to draw any conclusions. Further research is needed to assess the effects of culturally insensitive videotape on infant and social functioning.",AQ85CE,"The review provides some evidence that parenting interventions can improve the quality of life of adolescent mothers and their infants. However, the evidence is limited and the results are heterogeneous. The review highlights the need for more research to be conducted in this area."
CD008493,"Preoperative statin therapy reduces the odds of post-operative AF and shortens the stay on the ICU and in the hospital. Statin pretreatment had no influence on perioperative mortality, stroke, myocardial infarction or renal failure. Since analysed studies included mainly patients undergoing myocardial revascularizations the results cannot be extrapolated to patients undergoing other cardiac procedures such as heart valve or aortic surgery.",8FWF5T,There is insufficient evidence to support the use of statins in patients undergoing cardiac surgery. The is insufficient evidence to support the use of statins in patients undergoing cardiac surgery. The is insufficient evidence to support the use of statins in patients undergoing cardiac surgery.,JB6Z8F,There is insufficient evidence to support or refute the use of statins for the prevention of postoperative AF in patients undergoing elective CABG.
CD003782,"There is limited evidence to support the use of pilocarpine hydrochloride in the treatment of radiation-induced salivary gland dysfunction. Currently, there is little evidence to support the use of other parasympathomimetic drugs in the treatment of this condition. Available studies suggest approximately half of patients will respond, but side effects to responders can be problematic. Adverse effects are dose dependant therefore it is important to keep dose to 5 mg tds.",SPNXTA,There is insufficient evidence to support or refute the use of oral pilocarpine for the treatment of radiation-induced xerostomia.,AQ85CE,There is insufficient evidence to support the use of any of the adjuvant drugs for the treatment of post-radiation nausea and vomiting. There is a need for further well-designed RCTs to determine the role of adjuvenil treatment in the management of this common and distressing symptom.
CD006432,"There is insufficient good quality evidence to make recommendations about the relative effect of simultaneous bilateral training compared to placebo, no intervention or usual care. We identified evidence that suggests that bilateral training may be no more (or less) effective than usual care or other upper limb interventions for performance in ADL, functional movement of the upper limb or motor impairment outcomes.",AQ85CE,"There is evidence that arm training is effective in improving function in people with moderate to severe arm weakness. There is no evidence that it improves function in those with low to moderate arm weakness, but the evidence is limited. There are no studies assessing the effectiveness of arm training in people who are at high risk of arm weakness or who are in the subacute phase of rehabilitation.",PX7SGV,There is insufficient evidence from randomised controlled trials to support or refute the use of unilateral or bilateral arm training in the rehabilitation of people with chronic stroke.
CD000220,"Metronidazole, given as a single dose, is likely to provide parasitological cure for trichomoniasis, but it is not known whether this treatment will have any effect on pregnancy outcomes. The cure rate could probably be higher if more partners used the treatment.",JB6Z8F,There is insufficient evidence to support the routine use of metronidazole for trichomoniasis in pregnant women.,AQ85CE,Antibiotic treatment with metronidazole is effective in reducing the risk of preterm birth and stillbirth among women infected with trichomoniasis. The risk of neonatal death is higher with metonidazol. The optimal dose and duration of treatment remains unclear.
CD005463,"There is insufficient evidence to support the use of parenting programmes to treat physical abuse or neglect. There is, however, limited evidence to show that some parenting programmes may be effective in improving some outcomes that are associated with physically abusive parenting. Further research is urgently needed.",PX7SGV,There is insufficient evidence from randomised controlled trials to support or refute the effectiveness of parenting interventions for children at risk of re-admission.,VNCH8M,There is insufficient evidence to support or refute the effectiveness of multisystemic therapy for parents of children who are maltreated.
CD002873,"There is no clear benefit of using b2-agonists in the management of recurrent wheeze in the first two years of life although there is conflicting evidence. At present, further studies should only be performed if the patient group can be clearly defined and there is a suitable outcome parameter capable of measuring a response.",JB6Z8F,There is insufficient evidence to support the use of salbutamol for the treatment of acute wheezing in infants.,SPNXTA,There is no evidence that nebulised salbutamol improves wheezy infants' clinical status or airway obstruction. There is evidence that it may reduce the severity of cough and increase functional improvement. There was no evidence of a protective effect of nebulized salbutAMol on wheeze severity.
CD005087,We found no evidence that the topical administration of a short-acting sodium channel blocker improves respiratory condition in people with cystic fibrosis and some limited evidence of deterioration in lung function.,SPNXTA,There is insufficient evidence to support the routine use of nebulised amiloride for the treatment of respiratory exacerbations in people with cystic fibrosis. The included trials were underpowered to detect clinically important differences in the rate of improvement in FEV1. Nebulised amileptic therapy should not be recommended outside randomised clinical trials.,PX7SGV,There is insufficient evidence to support or refute the use of nebulised amiloride for the treatment of pneumonia in people with cystic fibrosis.
CD006866,"Oral acyclovir did not reduce the incidence of PHN significantly. There is insufficient evidence from randomised controlled trials to determine whether other antiviral treatments prevent PHN. Additional well-designed, randomised controlled trials of famciclovir or other new antiviral agents, with a greater number of participants are needed. Future trials should pay more attention to the severity of pain and quality of life of participants, and should be conducted among different subgroups of people, such as people who are immunocompromised.",8FWF5T,There is insufficient evidence to support the use of acyclovir for the treatment of herpes zoster. The evidence is insufficient to support the use of acyclovir for the treatment of herpes zoster. The evidence is insufficient to support the use of acyclovir for the treatment of herpes zoster.,JB6Z8F,There is insufficient evidence to support the use of oral acyclovir for the treatment of herpes zoster.
CD003054,"Interventions aimed at increasing exercise combined with diet are able to decrease the incidence of type 2 diabetes mellitus in high risk groups (people with impaired glucose tolerance or the metabolic syndrome). There is a need for studies exploring exercise only interventions and studies exploring the effect of exercise and diet on quality of life, morbidity and mortality, with special focus on cardiovascular outcomes.",PX7SGV,There is insufficient evidence from randomised controlled trials to determine whether lifestyle interventions are effective in preventing type 2 diabetes in people with impaired glucose tolerance.,8FWF5T,There is insufficient evidence to support the use of lifestyle interventions to prevent or delay the development of type 2 diabetes in people at high risk of developing the disease. The evidence is based on small studies and is limited by the heterogeneity of the studies. The is insufficient evidence to support the use of lifestyle interventions to prevent or delay the development of type 2 diabetes in people at high risk of developing the disease.
CD000405,"Evidence suggests that oral antibiotics reduce the incidence of NEC in low birth weight infants. However concerns about adverse outcomes persist, particularly related to the development of resistant bacteria. To address this question further, a large trial would be required with a sample size sufficient to examine all the important benefits and harms. Adverse outcomes associated with infection should be evaluated, and microbiological studies looking for the development of resistant bacteria should be undertaken",VNCH8M,There is insufficient evidence to support or refute the use of oral vancomycin for the prevention of NEC. Further research is needed.,AQ85CE,There is insufficient evidence to support the routine use of gentamicin to prevent NEC in preterm infants.
CD010611,Valproate is effective in reducing headache frequency and is reasonably well tolerated in adult patients with episodic migraine.,PX7SGV,There is insufficient evidence from randomised controlled trials to determine whether valproate is an effective treatment for migraine.,JB6Z8F,There is insufficient evidence to support the use of valproate as a prophylactic agent for migraine.
CD005538,"Diclofenac is an effective analgesic for perioperative acute pain in children. It causes similar types of serious adverse reactions in children as in adults, but these are rare. More research on optimum dosing and safety in asthmatic children is required.",VNCH8M,Diclofenac is an effective analgesic for postoperative pain control in children. The use of diclofenac is associated with fewer adverse events than other analgesics.,AQ85CE,There is insufficient evidence to draw conclusions about the effects of surgery on children and adolescents. There is a need for further well-designed randomised controlled trials.
CD004277,"There is limited evidence that cyclosporine is more effective than standard treatment alone for severe ulcerative colitis. The relatively quick response makes the short-term use of cyclosporine potentially attractive, but the long-term benefit is unclear, when adverse events such as cyclosporine-induced nephrotoxicity may become more obvious. There is a need for additional research on quality of life, costs and long-term results from cyclosporine therapy in severe ulcerative colitis.",JB6Z8F,There is insufficient evidence to support the use of cyclosporine as a single treatment for UC.,8FWF5T,There is no evidence that cyclosporine is an effective treatment for patients with ulcerative colitis. The is no evidence that cyclosporine is more effective than methylprednisolone. The is no evidence that cyclosporine is more effective than methylprednisolone. The is no evidence that cyclosporine is more effective than methylprednisolone. The is no evidence that cyclosporine is more effective than methylprednisolone.
CD005137,In some cases of unilateral refractive amblyopia it appears that there is a treatment benefit from refractive correction alone. Where amblyopia persists there is evidence that adding occlusion further improves vision. Despite advances in the understanding of the treatment of amblyopia it is currently still not possible to tailor individual treatment plans for amblyopia. The nature of any dose/response effect from occlusion still needs to be clarified. Partial occlusion appears to have the same treatment effect as glasses alone when started simultaneously for the treatment of unilateral refractive amblyopia. Treatment regimes for bilateral and unilateral refractive amblyopia need to be investigated further.,AQ85CE,"The limited evidence available suggests that 2 hours of daily photocoagulation is more effective than 6 hours of continuous photocoage in the treatment of mild amblyopia in children younger than 7 years of age. However, the evidence is based on a small number of small trials with short follow-up periods and is not strong enough to support the routine use of daily patching in this population.",SPNXTA,Optimal refractive correction improves amblyopic visual acuity compared with conventional patching. Optimal visual correction is not associated with improvement in amblyopia.
CD008388,There is limited evidence which supports the use of compensatory scanning training for patients with visual field defects (and possibly co-existing visual neglect) to improve scanning and reading outcomes. There is insufficient evidence to reach a conclusion about the impact of compensatory scanning training on functional activities of daily living. There is insufficient evidence to reach generalised conclusions about the benefits of visual restitution training (VRT) (restitutive intervention) or prisms (substitutive intervention) for patients with visual field defects after stroke.,8FWF5T,"There is insufficient evidence to support or refute the use of visual field therapy for people with visual system impairment due to stroke. The evidence is limited, and the results are not consistent across studies. The is a need for well-designed and adequately powered randomised controlled trials to determine the efficacy of visual field therapy for people with visual system impairment due to stroke.",VNCH8M,There is evidence that visual rehabilitation improves visual field size in patients with haemianopia. There is no evidence that visual rehabilitation improves visual field size in patients with haemianopia. There is no evidence that visual rehabilitation improves visual field size in patients with haemianopia.
CD003700,"The evidence does not suggest a significant reduction in mortality, measures of morbidity, nor an effect on the clinical course of pneumonia with vitamin A adjunctive treatment in children with non-measles pneumonia. However, not all studies measured all outcomes, which limited the number of studies that could be incorporated into the meta-analyses, so that there may have been a lack of statistical power to detect statistically significant differences.",VNCH8M,There is no evidence to support the use of vitamin A as an adjunct to standard treatment of pneumonia in children.,SPNXTA,There is insufficient evidence to support or refute the use of vitamin A in children with non-measles pneumonia.
CD000246,"This review fails to demonstrate a clear overall benefit from prophylactic antibiotic treatment for preterm labour with intact membranes on neonatal outcomes and raises concerns about increased neonatal mortality for those who received antibiotics. This treatment cannot therefore be currently recommended for routine practice. Further research may be justified (when sensitive markers for subclinical infection become available) in order to determine if there is a subgroup of women who could experience benefit from antibiotic treatment for preterm labour prior to membrane rupture, and to identify which antibiotic or combination of antibiotics is most effective.
[Note: The 17 citations in the awaiting classification section of the review may alter the conclusions of the review once assessed.]",SPNXTA,"Antibiotic treatment is associated with a reduction in the rate of preterm birth, a reduction of suspected sepsis, and an increased rate of NICU admission. However, there is no evidence of a benefit on other important maternal and neonatal outcomes. Further research is required to determine the optimal antibiotic regimen for women with threatened idiopathic preterm labour.",8FWF5T,There is insufficient evidence to support the routine use of antibiotics to prolong pregnancy in women with preterm labour. The evidence is insufficient to support routine antibiotic use to prolong pregnancy in women with preterm labour. The evidence is insufficient to support routine antibiotic use to prolong pregnancy in women with preterm labour.
CD005087,We found no evidence that the topical administration of a short-acting sodium channel blocker improves respiratory condition in people with cystic fibrosis and some limited evidence of deterioration in lung function.,SPNXTA,There is insufficient evidence to support the routine use of nebulised amiloride for the treatment of respiratory exacerbations in people with cystic fibrosis. The included trials were underpowered to detect clinically important differences in the rate of improvement in FEV1. Nebulised amileptic therapy should not be recommended outside randomised clinical trials.,JB6Z8F,There is currently no evidence to support the use of nebulised amiloride in the treatment of CF. Further randomised controlled trials are needed to determine the efficacy of nebulised amiloride in CF.
CD004998,"The small number of studies included in this review do not permit any conclusions to be drawn on the effectiveness of meditation therapy for anxiety disorders. Transcendental meditation is comparable with other kinds of relaxation therapies in reducing anxiety, and Kundalini Yoga did not show significant effectiveness in treating obsessive-compulsive disorders compared with Relaxation/Meditation. Drop out rates appear to be high, and adverse effects of meditation have not been reported. More trials are needed.",JB6Z8F,There is insufficient evidence to support the use of meditation for the treatment of obsessive-compulsive disorder.,AQ85CE,"There is insufficient evidence to support the use of any specific psychological interventions for anxiety disorders. There is a need for further well-designed, adequately powered, adequately reported randomised controlled trials."
