review_id,target,sys_a,A,sys_b,B
CD008361,"We could not find convincing evidence that NBI is significantly better than high definition WLC for the detection of patients with colorectal polyps, or colorectal adenomas. We found evidence that NBI might be better than standard definition WLC and equal to high definition WLC for detection the patients with colorectal polyps, or colorectal adenomas.",AQ85CE,There is evidence that NBI improves the detection of colorectal adenomatous polyps in colorespiratory endoscopy. The evidence is weak and inconclusive. The results of this review suggest that NII may be associated with a small reduction in the risk of colorem adenoma.,8FWF5T,There is insufficient evidence to support the use of adenoid coloscopy for the detection of colonic adenomas. The results of this review suggest that the use of adenoid coloscopy is associated with a significant increase in the detection of colonic adenomas. The results of this review suggest that the use of adenoid coloscopy is associated with a significant increase in the detection of colonic adenomas.
CD000996,"The present review indicates that there is insufficient evidence to recommend the routine use of inhaled steroids in adults with stable state bronchiectasis. While a therapeutic trial may be justified in adults with difficult to control symptoms and in certain subgroups, this has to be balanced with adverse events especially if high doses are used. No recommendation can be made for the use of ICS in adults during an acute exacerbation or in children (for any state) as there were no studies.",AQ85CE,"In patients with bronchiectasis, the evidence from the included studies was limited. There is no evidence to support the use of inhaled corticosteroids in the treatment of bronchiectomy.",8FWF5T,There is insufficient evidence to support the use of inhaled fluticasone in the treatment of patients with bronchiectasis. The evidence is insufficient to support the use of fluticasone in the treatment of patients with bronchiectasis.
CD003243,There is evidence that laparoscopic fundoplication surgery is more effective than medical management for the treatment of GORD at least in the short to medium term. Surgery does carry some risk and whether the benefits of surgery are sustained in the long term remains uncertain. Treatment decisions for GORD should be based on patient and surgeon preference.,AQ85CE,"The evidence from the included trials was limited. The small number of patients and the small sample sizes of the included studies limit the generalisability of the findings. The results suggest that laparoscopic surgery is an effective treatment for GOR. However, the evidence is based on a small number and is not robust. Further randomised controlled trials are needed to confirm the findings and to assess the long-term effects of laparoscopy.",PX7SGV,There is insufficient evidence to support or refute the use of laparoscopic Nissen fundoplication for the treatment of GORD.
CD004207,Treatment of neonatal unconjugated hyperbilirubinemia with metalloporphyrins may reduce neonatal bilirubin levels and decrease the need for phototherapy and hospitalization. There is no evidence to support or refute the possibility that treatment with a metalloporphyrin decreases the risk of neonatal kernicterus or of long-term neurodevelopmental impairment due to bilirubin encephalopathy. There is no evidence to support or refute the possibility that cutaneous photosensitivity is increased with metalloporphyrin treatment. Routine treatment of neonatal unconjugated hyperbilirubinemia with a metalloporphyrin cannot be recommended at present.,VNCH8M,Phototherapy is effective in reducing hyperbilirubinaemia in term and near term infants.,PX7SGV,There is insufficient evidence to support or refute the use of SnMP for the treatment of hyperbilirubinemia in term and near term infants.
CD003427,"Prophylactic penicillin significantly reduces risk of pneumococcal infection in children with homozygous sickle cell disease, and is associated with minimal adverse reactions. Further research may help to determine the ideal age to safely withdraw penicillin.",AQ85CE,The evidence from the two included trials is insufficient to determine whether the use of pneumococcal vaccine in children with sickle cell disease prevents the development of serotype-specific IgG antibodies. The use of vaccine in this population is associated with a reduction in the risk of severe adverse events.,JB6Z8F,There is insufficient evidence to support the routine use of oral penicillin in preventing pneumococcal infection in children with sickle cell anemia.
CD006268,"Propofol for sedation during colonoscopy for generally healthy individuals can lead to faster recovery and discharge times, increased patient satisfaction without an increase in side-effects. For the comparison of propofol administration by anaesthesiologists to that by non-anesthesiologists, we found insufficient high quality evidence. There is a need for better quality studies, with double blind randomizations, reporting of allocation concealment and more standardized reporting of outcomes.",VNCH8M,"Propofol is a more effective sedative for colonoscopy than midazolam. However, the use of propofol is associated with a longer recovery than midazolam.",AQ85CE,There is insufficient evidence to support the use of propofol/alfentanil for colonoscopy.
CD003978,"There is insufficient evidence from high quality comparative studies for the overall superiority of any individual type of prosthetic ankle-foot mechanism, although there is a small trend towards the Flex-foot in comparison with the SACH foot for greater stride length and lower energy cost in individuals with a transtibial amputation, and improved gait efficiency and lower energy cost in high activity individuals with a transfemoral amputation. In prescribing prosthetic-ankle foot mechanisms for individuals with a lower limb amputation, practitioners should take into account availability, patient functional needs, the type of knee mechanism to be prescribed and the inter-relationship with ankle-foot mechanisms, and cost.",VNCH8M,There is insufficient evidence to determine which type of prosthetic foot is the most appropriate for people with transtibial amputation.,8FWF5T,There is insufficient evidence to support the use of transtibial prostheses for the treatment of below-knee amputations. The results suggest that the use of transtibial prostheses may be beneficial for the majority of people with below-knee amputations. The results of this review suggest that the use of transtibial prostheses may be beneficial for the majority of people with below-knee amputations. The is insufficient evidence to support the use of transtibial prostheses for above-knee amputations.
CD004888,Peginterferon plus ribavirin may be considered a treatment for patients with chronic hepatitis C and stable HIV who have not received treatment for hepatitis C as the intervention may clear the blood of HCV RNA. Supporting evidence comes mainly from the analysis of this non-validated surrogate outcome assessed in comparisons against other antiviral treatments. There is no evidence on treatment of patients who have relapsed or did not respond to previous therapy. Careful monitoring of adverse events is warranted.,AQ85CE,"The evidence from this review suggests that interferon-only regimens are more effective than interferons-only for HCV infection. Interferon is associated with a higher incidence of adverse events than interfon-alone regimens, but the safety profile of interferron-alone is not clear.",PX7SGV,There is insufficient evidence to support or refute the use of interferon plus ribavirin for HCV treatment in HIV-infected patients.
CD004943,"The quality of the evidence was poor, but the findings suggest that the combination of antacids plus H2 antagonists was more effective than no intervention, and superior to antacids alone in preventing low gastric pH. However, none of the studies assessed potential adverse effects or substantive clinical outcomes. These findings are relevant for all women undergoing caesarean section under general anaesthesia.",PX7SGV,There is insufficient evidence to support or refute the use of oral antisecretory agents for caesarean section in women undergoing anaesthesia.,VNCH8M,Cimetidine is effective in reducing the risk of aspiration pneumonitis in women undergoing elective caesarean section. Adverse events were not reported.
CD003782,"There is limited evidence to support the use of pilocarpine hydrochloride in the treatment of radiation-induced salivary gland dysfunction. Currently, there is little evidence to support the use of other parasympathomimetic drugs in the treatment of this condition. Available studies suggest approximately half of patients will respond, but side effects to responders can be problematic. Adverse effects are dose dependant therefore it is important to keep dose to 5 mg tds.",AQ85CE,There is insufficient evidence to support the use of any of the adjuvant drugs for the treatment of post-radiation nausea and vomiting. There is a need for further well-designed RCTs to determine the role of adjuvenil treatment in the management of this common and distressing symptom.,JB6Z8F,There is insufficient evidence to support the use of pilocarpine for the symptomatic relief of post-radiation dry mouth.
CD003421,These results suggest that calcium channel blockers given in the peri-operative period may reduce the incidence of ATN post-transplantation. The result should be treated with caution due to the heterogeneity of the trials which made comparison of studies and pooling of data difficult.,PX7SGV,There is insufficient evidence from randomised controlled trials to support or refute the use of calcium antagonists in patients undergoing cadaveric kidney transplantation.,8FWF5T,There is insufficient evidence to support the use of calcium channel blockers in the management of acute tubular necrosis following renal transplantation. The is insufficient evidence to support the use of calcium channel blockers in the management of acute tubular necrosis following renal transplantation.
CD002815,"Considering the small number of patients examined, the methodological flaws in many of the studies and the possibility of publication bias, there is insufficient evidence to support or refute the efficacy of any given form of physiotherapy over another in Parkinson's disease. Another Cochrane review, Physiotherapy for patients with Parkinson's Disease, found that there was insufficient evidence to support or refute the efficacy of physiotherapy compared to no physiotherapy in Parkinson's disease. 
A wide range of physiotherapy approaches were used in these studies and a survey of UK physiotherapists confirmed that they also use an eclectic combination of techniques in the treatment of Parkinson's disease (Plant 1999). Therefore a consensus must be found as to 'best practice' physiotherapy for Parkinson's disease.
The efficacy of 'standard' physiotherapy should be proved first before examining variations in physiotherapy methods. Therefore large well designed randomised controlled trials are needed to judge the effect of physiotherapy in Parkinson's disease. After this large RCTs are needed to demonstrate the most effective form of physiotherapy in Parkinson's disease. Outcome measures with particular relevance to patients, carers, physiotherapists and physicians should be chosen and the patients monitored for at least 6 months to determine the duration of any effect. The trials should be reported according to CONSORT guidelines (CONSORT 1996).",VNCH8M,There is insufficient evidence to support or refute the use of auditory stimulation in the rehabilitation of Parkinson's disease patients.,8FWF5T,There is insufficient evidence to support or refute the use of music-based interventions for people with idiopathic myasthenia gravis. The research should focus on the use of music-based interventions for people with idiopathic myasthenia gravis.
CD004787,There is no firm evidence to support or refute TACE or TAE for patients with unresectable HCC. More adequately powered and bias-protected trials are needed.,SPNXTA,There is insufficient evidence to recommend the use of TACE over conservative management in patients with unresectable HCC.,AQ85CE,There is no evidence to support the routine use of chemoembolisation for patients with unresectable hepatocellular carcinoma.
CD003351,Since the last version of this review three new studies were identified but excluded from the review. Current evidence is insufficient to assess the benefits and harms of ketamine as an adjuvant to opioids for the relief of cancer pain. More RCTs are needed.,8FWF5T,"There is insufficient evidence to support the use of ketamine for the treatment of postoperative pain. The evidence is limited, however, from trials with small sample sizes and small patient numbers. The evidence is insufficient to support the use of ketamine for the treatment of postoperative pain.",SPNXTA,There is insufficient evidence to recommend the use of ketamine for the treatment of cancer pain.
CD008388,There is limited evidence which supports the use of compensatory scanning training for patients with visual field defects (and possibly co-existing visual neglect) to improve scanning and reading outcomes. There is insufficient evidence to reach a conclusion about the impact of compensatory scanning training on functional activities of daily living. There is insufficient evidence to reach generalised conclusions about the benefits of visual restitution training (VRT) (restitutive intervention) or prisms (substitutive intervention) for patients with visual field defects after stroke.,JB6Z8F,There is insufficient evidence to support the use of any intervention for the treatment of visual field defects in people with stroke.,8FWF5T,"There is insufficient evidence to support or refute the use of visual field therapy for people with visual system impairment due to stroke. The evidence is limited, and the results are not consistent across studies. The is a need for well-designed and adequately powered randomised controlled trials to determine the efficacy of visual field therapy for people with visual system impairment due to stroke."
CD008012,"Psychological interventions and pharmacological interventions with SSRIs may have a small yet clinically meaningful effect on depression outcomes in CAD patients. No beneficial effects on the reduction of mortality rates and cardiac events were found. Overall, however, the evidence is sparse due to the low number of high quality trials per outcome and the heterogeneity of examined populations and interventions.",AQ85CE,Cognitive behavioural therapy is effective in reducing the risk of relapse and recurrence of depressive symptoms in patients with post-surgery depression.,PX7SGV,There is insufficient evidence from randomised controlled trials to support the use of antidepressants in the treatment of depression in patients with MI.
CD001715,"Sertindole at a dose of 20mg/day was found to be more antipsychotic than placebo. When used at 8, 12 or 20mg/day it appears to be as acceptable as placebo (in terms of various adverse events including movement disorders and somnolence), but seems to be associated with more cardiac problems (8, 12 or 20mg/day) and an increase in weight gain (20mg/day) than placebo.
Sertindole at a dose of 24mg/day was better tolerated than haloperidol (in terms of participants leaving the study early). It was also found to be was associated with fewer movement disorders (at 8, 16, 20 or 24mg/day) and sedation (8 or 24mg/day) than haloperidol. However, it was shown to cause more cardiac anomalies (16, 20 or 24mg/day), weight gain (all doses combined), rhinitis (16 or 24mg/day), and problems with sexual functioning (24mg/day) than haloperidol. One short term study reported that sertindole 16mg/day was the most optimal dose.",JB6Z8F,"Sertindole is an effective antipsychotic drug for the treatment of schizophrenia. Its adverse effects are mild and transient, and its long-term efficacy is not known.",PX7SGV,"Thereertindole is an effective antipsychotic in the treatment of schizophrenia. However, its use is limited by the small number of studies included in this review and its small sample size. Further well-designed RCTs are needed."
CD003913,This small but clear improvement in survival from chemotherapy encourages further study of drug treatment of these tumours,AQ85CE,The results of this review suggest that there is no evidence to support the use of adjuvant CT for patients with malignant gliomas.,VNCH8M,Radiotherapy alone is not an effective treatment for malignant glioma. The combination of radiotherapy and chemotherapy appears to be an effective treatment for patients with malignant glioma.
CD004115,Rectal 5-ASA should be considered a first-line therapy for patients with mild to moderately active distal UC. The optimal total daily dose and dose frequency of 5-ASA remain to be determined. Future research should define differences in efficacy among patient subgroups defined by proximal disease margin and disease activity. There is a strong need for consensus standardization of outcome measurements for clinical trials in ulcerative colitis.,SPNXTA,"5-ASA appears to be an effective treatment for mild to moderate disease in distal ulcerative colitis. However, there is insufficient evidence to conclude that it is superior to other topical treatments.",VNCH8M,"5-ASA is an effective treatment for distal ulcerative colitis. However, the high instability of this metabolite makes its use of 5-ASA difficult to justify."
CD003009,"NRT appears to be a safe and effective intervention for the treatment of chronic non-specific LBP. The efficacy is less clear for sub-acute LBP. However, these results are limited to three trials conducted by a small number of specifically trained and experienced clinicians, in a limited geographical location. No data are available on the ease and time-frame needed to achieve that level of expertise. RCTs by other practitioners, in other locations, that replicate the effects reported in this review are needed before recommending a broader practice.",JB6Z8F,There is insufficient evidence to support the use of neuroreflexotherapy for the treatment of low-back pain.,PX7SGV,There is insufficient evidence from randomised controlled trials to support the use of neuroreflexotherapy for the treatment of chronic low-back pain.
CD002068,There is evidence to support the effectiveness of bisphosphonates in providing some pain relief for bone metastases. There is insufficient evidence to recommend bisphosphonates for immediate effect; as first line therapy; to define the most effective bisphosphonates or their relative effectiveness for different primary neoplasms. Bisphosphonates should be considered where analgesics and/or radiotherapy are inadequate for the management of painful bone metastases.,JB6Z8F,There is insufficient evidence to support the use of pamidronate for the treatment of bone pain in patients with metastatic bone disease.,8FWF5T,There is insufficient evidence to support the use of bisphosphonates for the treatment of pain in patients with metastatic bone disease. The evidence is based on small trials and is limited by the heterogeneity of the included studies. The evidence is insufficient to support the use of bisphosphonates for the treatment of pain in patients with metastatic bone disease.
CD003421,These results suggest that calcium channel blockers given in the peri-operative period may reduce the incidence of ATN post-transplantation. The result should be treated with caution due to the heterogeneity of the trials which made comparison of studies and pooling of data difficult.,VNCH8M,There is evidence that calcium antagonists reduce the risk of tubular necrosis in kidney transplantation recipients. There is no evidence that calcium antagonists reduce the risk of graft rejection.,SPNXTA,"There is some evidence that immunosuppression may improve the outcome of kidney transplantation recipients. However, the evidence is not strong enough to support or refute the use of immunossuppression in this setting. Calcium channel blockers and verapamil may have a beneficial effect on renal function but the evidence for their beneficial effects is inconclusive. Further research is needed to determine the optimal dose and duration of calcium channel blocker administration and to compare these with other immunocompressive agents, including calcium channel blockers."
CD002231,"Based on one low quality trial, the medicinal herb 'Jianpi Wenshen recipe' may have an antiviral activity in asymptomatic carriers of hepatitis B virus. However, rigorous randomised, double-blind, placebo-controlled trials are needed before herbs should be used for this condition.",JB6Z8F,Phyllanthus amarus is effective in the treatment of chronic hepatitis B virus carriers.,AQ85CE,"The evidence from the included trials was limited. There was no evidence of benefit from any of the herbal medicines reviewed. There is a need for further well-designed, adequately powered, randomised controlled trials to evaluate the effects of phyllanthus amarus for hepatitis B."
CD001293,"Pure Prevention cohorts showed a significant effect at longest follow-up, with an average 12% reduction in starting smoking compared to the control groups. However, no overall effect was detected at one year or less. The combined social competence and social influences interventions showed a significant effect at one year and at longest follow-up. Studies that deployed a social influences programme showed no overall effect at any time point; multimodal interventions and those with an information-only approach were similarly ineffective.
Studies reporting Change in Smoking Behaviour over time did not show an overall effect, but at an intervention level there were positive findings for social competence and combined social competence and social influences interventions.",JB6Z8F,There is insufficient evidence to support the effectiveness of school-based smoking prevention programmes.,VNCH8M,"Educational programmes are effective in preventing smoking and drug abuse among young people. However, the quality of the evidence is low. The results of this review suggest that the effects of educational programmes on drug abuse are small and probably not clinically important."
CD004998,"The small number of studies included in this review do not permit any conclusions to be drawn on the effectiveness of meditation therapy for anxiety disorders. Transcendental meditation is comparable with other kinds of relaxation therapies in reducing anxiety, and Kundalini Yoga did not show significant effectiveness in treating obsessive-compulsive disorders compared with Relaxation/Meditation. Drop out rates appear to be high, and adverse effects of meditation have not been reported. More trials are needed.",PX7SGV,There is insufficient evidence to support or refute the use of meditation for the treatment of obsessive-compulsive disorder.,SPNXTA,There is insufficient evidence from randomised controlled trials to determine the role of meditation in the treatment of anxiety.
CD007289,"P-Chem may reduce the risk of progression to GTN in women with CMs who are at a high risk of malignant transformation; however, current evidence in favour of P-Chem is limited by the poor methodological quality and small size of the included studies. As P-Chem may increase drug resistance, delay treatment of GTN and expose women unnecessarily to toxic side effects, this practice cannot currently be recommended.",AQ85CE,There is insufficient evidence to support the routine use of prophylactic antibiotics in the treatment of complete hydatidiform mole.,8FWF5T,There is insufficient evidence to recommend the use of prophylactic chemotherapy for patients with persistent trophoblastic disease. The results suggest that prophylactic chemotherapy may be beneficial in patients at high risk of developing secondary malignancy. The is a need for well-designed randomised controlled trials to determine the optimal prophylactic chemotherapy for patients with persistent trophoblastic disease.
CD007979,"As only one study was identified for inclusion, the results are inadequate to inform clinical practice in regard to the use of email for clinical communication between healthcare professionals. Future research needs to use high-quality study designs that take advantage of the most recent developments in information technology, with consideration of the complexity of email as an intervention, and costs.",PX7SGV,There is insufficient evidence to support or refute the use of electronic medical record reminders for postfracture patients. Further research is needed.,JB6Z8F,There is insufficient evidence to support the use of EMRs to improve osteoporosis management after a fracture.
