review_id,target,sys_a,A,sys_b,B
CD002873,"There is no clear benefit of using b2-agonists in the management of recurrent wheeze in the first two years of life although there is conflicting evidence. At present, further studies should only be performed if the patient group can be clearly defined and there is a suitable outcome parameter capable of measuring a response.",PX7SGV,There is insufficient evidence from randomised controlled trials to support or refute the use of beta2 agonists in the treatment of wheezy infants.,JB6Z8F,There is insufficient evidence to support the use of salbutamol for the treatment of acute wheezing in infants.
CD005203,"There may be some benefit in using an egg-free diet in infants with suspected egg allergy who have positive specific IgE to eggs. Little evidence supports the use of various exclusion diets in unselected people with atopic eczema, but that may be because they were not allergic to those substances in the first place. Lack of any benefit may also be because the studies were too small and poorly reported. Future studies should be appropriately powered focusing on participants with a proven food allergy. In addition a distinction should be made between young children whose food allergies improve with time and older children/adults.",JB6Z8F,There is insufficient evidence to support the use of any specific diet for the management of eczema in infants. Further research is required to determine the optimal diet for the management of eczema in infants.,AQ85CE,There is insufficient evidence to support the use of protein-based formulas in the treatment of allergy in infants. Further research is needed to determine whether protein-containing formulas are more effective than no treatment or placebo in the prevention of allergy.
CD003038,"Beta-lactam monotherapy is advantageous compared with beta-lactam-aminoglycoside combination therapy with regard to survival, adverse events and fungal super-infections. Treatment failure should not be regarded as the primary outcome in open-label trials, as it reflects mainly treatment modifications.",8FWF5T,There is insufficient evidence to support the use of antibiotics in the treatment of febrile neutropenic sepsis. The evidence is insufficient to support the use of antibiotics in the treatment of febrile neutropenic sepsis. The evidence is insufficient to support the use of antibiotics in the treatment of febrile neutropenic sepsis.,JB6Z8F,The use of cefotaxime plus amikacin as an empiric therapy for febrile neutropenia is not supported by the evidence. The use of cefotaxime plus amikacin as an empiric therapy for febrile neutropenia is not supported by the evidence.
CD002815,"Considering the small number of patients examined, the methodological flaws in many of the studies and the possibility of publication bias, there is insufficient evidence to support or refute the efficacy of any given form of physiotherapy over another in Parkinson's disease. Another Cochrane review, Physiotherapy for patients with Parkinson's Disease, found that there was insufficient evidence to support or refute the efficacy of physiotherapy compared to no physiotherapy in Parkinson's disease. 
A wide range of physiotherapy approaches were used in these studies and a survey of UK physiotherapists confirmed that they also use an eclectic combination of techniques in the treatment of Parkinson's disease (Plant 1999). Therefore a consensus must be found as to 'best practice' physiotherapy for Parkinson's disease.
The efficacy of 'standard' physiotherapy should be proved first before examining variations in physiotherapy methods. Therefore large well designed randomised controlled trials are needed to judge the effect of physiotherapy in Parkinson's disease. After this large RCTs are needed to demonstrate the most effective form of physiotherapy in Parkinson's disease. Outcome measures with particular relevance to patients, carers, physiotherapists and physicians should be chosen and the patients monitored for at least 6 months to determine the duration of any effect. The trials should be reported according to CONSORT guidelines (CONSORT 1996).",8FWF5T,There is insufficient evidence to support or refute the use of music-based interventions for people with idiopathic myasthenia gravis. The research should focus on the use of music-based interventions for people with idiopathic myasthenia gravis.,SPNXTA,There is insufficient evidence to support or refute the use of RAS in the management of patients with Parkinson's disease.
CD002896,"VNS for partial seizures appears to be an effective and well tolerated treatment. Adverse effects of hoarseness, cough, pain, paresthesias, and dyspnea are associated with the treatment but appear to be reasonably well tolerated as dropouts were rare. Typical central nervous system adverse effects of antiepileptic drugs such as ataxia, dizziness, fatigue, nausea, and somnolence were not statistically significantly associated with VNS treatment.",VNCH8M,There is insufficient evidence to support the use of vagus nerve stimulation for the treatment of epilepsy.,PX7SGV,There is insufficient evidence from randomised controlled trials to determine whether Vagus nerve stimulation is an effective treatment for epilepsy. Further trials are needed.
CD010256,In the included RCTs there was no consistent evidence favouring either IV beta2-agonists or IV aminophylline for patients with acute asthma. The opportunity to draw clear conclusions is limited by the heterogeneity of outcomes evaluated and the small sample sizes in the included studies. It is recommended that these data should be viewed carefully alongside the conclusions from separate Cochrane reviews comparing IV beta2-agonists plus inhaled beta2-agonists versus inhaled beta2-agonists alone and IV aminophylline plus inhaled beta2-agonists versus inhaled beta2-agonists alone.,VNCH8M,There is insufficient evidence to determine whether aminophylline is more effective than salbutamol in the initial treatment of acute asthma.,SPNXTA,There is no evidence to support the use of intravenous salbutamol for patients with acute asthma.
CD004214,Medically stable preterm infants can be transferred to unheated open cots at a lower body weight of 1600 grams without adverse effects on temperature stability or weight gain. Earlier transfer does not necessarily result in earlier discharge.,PX7SGV,There is insufficient evidence from randomised controlled trials to support or refute the routine use of thermal weaning in preterm infants.,SPNXTA,"Early weaning of preterm infants from the incubator does not appear to result in a significant reduction in the number of infants readmitted to hospital, but may result in earlier discharge."
CD002828,Limited evidence from randomised controlled trials suggests that corticosteroid treatment offers short-term benefit in myasthenia gravis compared with placebo. This supports the conclusions of observational studies and expert opinion. Limited evidence from randomised controlled trials does not show any difference in efficacy between corticosteroids and either azathioprine or intravenous immunoglobulin.,SPNXTA,There is insufficient evidence to determine whether the addition of azathioprine to prednisone is beneficial or harmful for the treatment of myasthenia gravis.,AQ85CE,"The available evidence is insufficient to determine whether corticosteroids are effective in the treatment of GAG. The small number of studies and the small sample sizes of the included studies limit the generalisability of the findings. Further well-designed, adequately powered randomised controlled trials are needed to determine the optimal corticolic dose and duration of treatment for GAG, and to assess the effects of corticogenic steroids on muscle strength, function, and quality of life."
CD001342,"For the secondary prevention of recurrent ischemic stroke after TIA or minor stroke of presumed arterial origin, there is sufficient evidence to conclude that vitamin K antagonists in any dose are not more efficacious than antiplatelet therapy and that medium and high intensity anticoagulation leads to a significant increase in major bleeding complications.",PX7SGV,There is insufficient evidence to support or refute the use of anticoagulants for the prevention of stroke in patients with transient ischaemic stroke.,SPNXTA,"Oral anticoagulants are more effective than aspirin in the prevention of transient ischaemic stroke or RIND. However, there is no evidence to support the use of these drugs in the treatment of patients with non-valuable ischaemia."
CD000980,"The failure of vitamin C supplementation to reduce the incidence of colds in the general population indicates that routine vitamin C supplementation is not justified, yet vitamin C may be useful for people exposed to brief periods of severe physical exercise. Regular supplementation trials have shown that vitamin C reduces the duration of colds, but this was not replicated in the few therapeutic trials that have been carried out. Nevertheless, given the consistent effect of vitamin C on the duration and severity of colds in the regular supplementation studies, and the low cost and safety, it may be worthwhile for common cold patients to test on an individual basis whether therapeutic vitamin C is beneficial for them. Further therapeutic RCTs are warranted.",PX7SGV,There is insufficient evidence from randomised controlled trials to support or refute the use of vitamin C in the treatment of colds.,AQ85CE,"Vitamin C may be effective in relieving symptoms of the common cold. However, the evidence is limited. The trials included in this review were small and of poor quality. Further research is needed to determine the optimal dose and duration of treatment."
CD006665,"A single, non-randomised, poorly reported trial of vitamin C as a treatment for tetanus suggests a considerable reduction in mortality. However, concerns about trial quality mean that this result must be interpreted with caution and that vitamin C cannot be recommended as a treatment for tetanus on the basis of this evidence. New trials should be carried out to examine the effect of vitamin C on tetanus treatment.",8FWF5T,There is insufficient evidence to support the routine use of titetanus for tetanus in older people. The evidence is insufficient to support the routine use of titetanus for tetanus in older people.,SPNXTA,There is not enough evidence to support or refute the use of ascorbic acid for the treatment of tetanus.
CD001431,"New for this updated review is evidence that: decision aids with explicit values clarification exercises improve informed values-based choices; decision aids appear to have a positive effect on patient-practitioner communication; and decision aids have a variable effect on length of consultation.
Consistent with findings from the previous review, which had included studies up to 2006: decision aids increase people's involvement, and improve knowledge and realistic perception of outcomes; however, the size of the effect varies across studies. Decision aids have a variable effect on choices. They reduce the choice of discretionary surgery and have no apparent adverse effects on health outcomes or satisfaction. The effects on adherence with the chosen option, patient-practitioner communication, cost-effectiveness, and use with developing and/or lower literacy populations need further evaluation. Little is known about the degree of detail that decision aids need in order to have positive effects on attributes of the decision or decision-making process.",VNCH8M,"Decision aids can assist patients in making informed decisions about health care interventions. The evidence is limited, however, and the results should be interpreted with caution.",JB6Z8F,There is insufficient evidence to support the use of computerised decision aids for prostate cancer screening.
CD004611,There is insufficient evidence to recommend probiotic therapy as an adjunct to antibiotic therapy for C. difficile colitis. There is no evidence to support the use of probiotics alone in the treatment of C. difficile colitis.,JB6Z8F,There is insufficient evidence to support the use of probiotics for the treatment of recurrent CDD.,8FWF5T,There is insufficient evidence to support the use of probiotics in the treatment of patients with recurrent or complicated clostridium difficile infection. The is a need for larger randomised controlled trials to evaluate the efficacy of probiotics in the treatment of patients with recurrent or complicated clostridium difficile infection.
CD006853,"Based on the evidence, aerobic capacity training combined with muscle strength training is recommended as routine practice in patients with RA.",SPNXTA,There is insufficient evidence to support the use of long-term aerobic exercise for the treatment of rheumatoid arthritis.,VNCH8M,There is insufficient evidence to support the use of exercise for the treatment of RA.
CD003225,"Although many trials have relevant methodological shortcomings, there is clear evidence that propranolol is more effective than placebo in the short-term interval treatment of migraine. Evidence on long-term effects is lacking. Propranolol seems to be as effective and safe as a variety of other drugs used for migraine prophylaxis.",SPNXTA,"5-HT uptake inhibitors are at least as effective as placebo in reducing migraine frequency. However, there is a need for further well-conducted randomised controlled trials.",PX7SGV,There is insufficient evidence to support or refute the use of beta-blockers in migraine prophylaxis.
CD007214,There is only limited evidence that TENS reduces pain in labour and it does not seem to have any impact (either positive or negative) on other outcomes for mothers or babies. The use of TENS at home in early labour has not been evaluated. TENS is widely available in hospital settings and women should have the choice of using it in labour.,AQ85CE,There is insufficient evidence to support the use of TENS in labour and birth.,JB6Z8F,There is insufficient evidence to support the use of TENS for pain relief in labour. Further research is required.
CD003159,"The clinical studies on nicergoline were carried out with diverse criteria and modalities of evaluation. Despite this, the 14 studies included in this review, have presented generally consistent results. Results of this meta-analysis provide some evidence of positive effects of nicergoline on cognition and behaviour and these effects are supported by an effect on clinical global impression. There was some evidence that there were increased risk of adverse effects associated with nicergoline. These results were obtained on older patients with mild to moderate cognitive and behavioural impairment of various clinical origins, including chronic cerebrovascular disorders and Alzheimer's dementia. The few studies specifically performed on patients with Alzheimer's disease were performed with too few people to give a definitive answer to the questions concerning the use of nicergoline for this form of dementia.This drug has not been evaluated using current diagnostic categories such as MCI or in association with therapeutic agents of different nature such as cholinesterase or antioxidant drugs.",PX7SGV,There is insufficient evidence to support or refute the use of nicergoline for the treatment of mild to moderate dementia.,VNCH8M,"Nicergoline is an effective treatment for the treatment of dementia. However, the evidence is limited and inconclusive."
CD003266,"Treatment with rHu EPO in pre-dialysis patients corrects anaemia, avoids the requirement for blood transfusions and also improves quality of life and exercise capacity. We were unable to assess the effects of rHu EPO on progression of renal disease, delay in the onset of dialysis or adverse events. Based on the current evidence, decisions on the putative benefits in terms of quality of life are worth the extra costs of pre-dialysis rHu EPO need careful evaluation.",JB6Z8F,There is insufficient evidence to support the use of r-HuEPO in the treatment of chronic renal failure.,VNCH8M,EPO is effective in correcting anemia in predialysis patients without increasing the risk of renal failure or progression to CKD.
CD002179,"There is no evidence to show that oxatomide has a significant effect on the control of stable asthma. Some studies reported significant benefits in subjective parameters. There was improvement in some lung function outcomes reported, but this were not consistent across measures or studies and may represent reporting bias. Adverse events, including drowsiness, were significantly greater with oxatomide than placebo.",JB6Z8F,There is insufficient evidence to support the use of oxatomide in the treatment of children with asthma.,AQ85CE,There is no evidence to support the use of oral oxatomide in children with chronic asthma.
CD005522,"Tramadol or tramadol/paracetamol decreases pain intensity, produces symptom relief and improves function, but these benefits are small. Adverse events, although reversible and not life threatening, often cause participants to stop taking the medication and could limit tramadol or tramadol plus paracetamol usefulness.",AQ85CE,"Tramadol is an effective analgesic for moderate to severe OA, providing pain relief at least equivalent to commonly used NSAIDs, with a lower incidence of adverse events. The addition of tramadol to commonly prescribed NSAIDs provides pain relief equivalent to about half of those treated with placebo, and comparable to about one-third of those given with placebo.",PX7SGV,There is insufficient evidence to support or refute the use of tramadol in the treatment of osteoarthritis.
CD006332,"Insufficient evidence exists for the safety or efficacy of naloxone or nalbuphine in the treatment of OBD. Long-term efficacy and safety of any of the opioid antagonists is unknown, as is the incidence or nature of rare adverse events. Alvimopan and methylnaltrexone both show promise in treating OBD, but further data will be required to fully assess their place in therapy.",VNCH8M,There is insufficient evidence to support the use of peripheral opioid antagonists for the management of gastrointestinal complications. Further research is needed.,SPNXTA,Methylnaltrexone and diphenhydramine are effective in reversing gastrointestinal effects of opioids in patients with chronic constipation. Adverse events are frequent and severe.
CD006400,"The effects of dietary manipulation, including vegetarian, Mediterranean, elemental and elimination diets, on rheumatoid arthritis are still uncertain due to the included studies being small, single trials with moderate to high risk of bias. Higher drop-out rates and weight loss in the groups with dietary manipulation indicate that potential adverse effects should not be ignored.",AQ85CE,There is insufficient evidence to support or refute the use of dietary advice to reduce the risk of cardiovascular events in patients with RA.,SPNXTA,There is insufficient evidence to support or refute the use of any specific dietary intervention for the treatment of rheumatoid arthritis.
CD003200,"There is encouraging evidence that some patients may benefit from exercise therapy and no evidence that exercise therapy may worsen outcomes on average. However the treatment may be less acceptable to patients than other management approaches, such as rest or pacing. Patients with CFS who are similar to those in these trials should be offered exercise therapy, and their progress monitored Further high quality randomised studies are needed.",JB6Z8F,There is insufficient evidence to support the use of graded exercise as a treatment for fatigue in people with CFS.,PX7SGV,There is insufficient evidence from randomised controlled trials to support the routine use of graded exercise therapy for people with chronic fatigue syndrome.
CD008870,"Sulfasalazine has modest efficacy compared to placebo and is inferior to corticosteroids for the treatment of mild to moderately active Crohn's disease. Olsalazine and low dose mesalamine (1 to 2 g/day) are not superior to placebo. High dose mesalamine (3 to 4.5 g/day) is not more effective than placebo for inducing response or remission. High dose mesalamine was inferior to budesonide for inducing remission in a single trial. In conclusion, sulfasalazine shows modest efficacy for the treatment of active Crohn's disease. However, the existing data show little benefit for 5-aminosalicylates.",VNCH8M,5-ASA is effective in the treatment of active Crohn's disease. Adverse events are common and not serious.,JB6Z8F,There is insufficient evidence to support the use of 5-ASA for the treatment of active Crohn's disease.
CD005486,Only three trials with a short follow-up duration were found. There is insufficient evidence to recommend the use of silver-containing dressings or topical agents for treatment of infected or contaminated chronic wounds.,SPNXTA,"Silver-releasing dressings appear to be beneficial for the healing of venous leg ulcers. However, there is insufficient evidence to support or refute the use of silver dressings in the management of chronic wounds.",PX7SGV,There is insufficient evidence to support or refute the use of silver-releasing foam wound healing dressings in the treatment of chronic wounds.
CD008870,"Sulfasalazine has modest efficacy compared to placebo and is inferior to corticosteroids for the treatment of mild to moderately active Crohn's disease. Olsalazine and low dose mesalamine (1 to 2 g/day) are not superior to placebo. High dose mesalamine (3 to 4.5 g/day) is not more effective than placebo for inducing response or remission. High dose mesalamine was inferior to budesonide for inducing remission in a single trial. In conclusion, sulfasalazine shows modest efficacy for the treatment of active Crohn's disease. However, the existing data show little benefit for 5-aminosalicylates.",JB6Z8F,There is insufficient evidence to support the use of 5-ASA for the treatment of active Crohn's disease.,AQ85CE,5-ASA is effective in inducing remission in patients with CD. The clinical benefit of 5-ASAs in inducing CD remission is small and the clinical significance of the observed benefit is unclear. The benefit of using 5-asA in combination with other therapies is not clear.
CD005542,"There is little evidence to support the use of one particular form of insulin administration over another for pregnant women with diabetes. The data are few, there are only a small number of trials appropriate for meta-analysis, a small number of women included and questionable generalisability of the trial population. Conclusions cannot be made from the available data. Well-designed randomised trials are needed. These trials should be adequately powered to assess the effect of CSII versus MDI on important outcomes for women with diabetes and their infants.",PX7SGV,There is insufficient evidence from randomised controlled trials to support or refute the use of CSII for women with type 1 diabetes mellitus.,8FWF5T,There is insufficient evidence to support or refute the use of insulin for the control of hyperglycaemic conditions in pregnancy. The is insufficient evidence to support or refute the use of insulin for the control of hyperglycaemic conditions in pregnancy. The evidence is insufficient to support or refute the use of insulin for the control of hyperglycaemic conditions in pregnancy.
CD001340,"A policy of using ECMO in mature infants with severe but potentially reversible respiratory failure results in significantly improved survival without increased risk of severe disability. The benefit of ECMO for babies with diaphragmatic hernia is unclear.
Further studies are needed to consider the optimal timing for introducing ECMO; to identify which infants are most likely to benefit; and to address the implications of neonatal ECMO during later childhood and adult life.",PX7SGV,There is insufficient evidence to support or refute the use of extracorporeal membrane oxygenation in the treatment of neonates with persistent pulmonary hypertension.,SPNXTA,There is insufficient evidence to support the use of extracorporeal membrane oxygenation in preterm infants with persistent pulmonary hypertension and respiratory failure.
CD004572,We found no statistically significant difference between aldose reductase inhibitors and placebo in the treatment of diabetic polyneuropathy. Any future clinical trials of aldose reductase inhibitors should be restricted to compounds proven to have substantial biological or preclinical advantages over previously tested agents.,JB6Z8F,There is insufficient evidence to support the use of tolrestat for the treatment of peripheral neuropathy.,8FWF5T,There is insufficient evidence to support the use of aldose reductase inhibitors in the treatment of diabetic peripheral neuropathy. The evidence is insufficient to support the use of these agents in the treatment of diabetic peripheral neuropathy.
CD008361,"We could not find convincing evidence that NBI is significantly better than high definition WLC for the detection of patients with colorectal polyps, or colorectal adenomas. We found evidence that NBI might be better than standard definition WLC and equal to high definition WLC for detection the patients with colorectal polyps, or colorectal adenomas.",AQ85CE,There is evidence that NBI improves the detection of colorectal adenomatous polyps in colorespiratory endoscopy. The evidence is weak and inconclusive. The results of this review suggest that NII may be associated with a small reduction in the risk of colorem adenoma.,PX7SGV,"There is insufficient evidence to support or refute the use of NBI in the screening of colorectal cancer. There is a need for well-designed, adequately powered randomised controlled trials."
